long, L AO1 NG , s, 
live, L AY1 V , s, 
queen, K W IY1 N , s, 
margaret, M AA1 R G ER0 IH0 T , s, 
england's, IH1 NG G L AH0 N D Z , s, 
happiness, HH AE1 P IY0 N AH0 S , s, 
for, F AO1 R , s, 
grief, G R IY1 F , s, 
that, DH AE1 T , s, 
they, DH EY1 , s, 
are, AA1 R , s, 
past, P AW S T, s, 
recovery, r IH ˈ K ɤ V r ǝ IH, s, 
for, F AO1 R , s, 
were, W ER1 , s, 
there, DH EH1 R , s, 
hope, HH OW1 P , s, 
to, T UW1 , s, 
conquer, K AA1 NG K ER0 , s, 
them, DH EH1 M , s, 
again, ǝ ˈ ɡ EH: : N, s, 
my, M AY1 , s, 
sword, S AO1 R D , s, 
should, SH UH1 D , s, 
shed, SH EH1 D , s, 
hot, HH AA1 T , s, 
blood, B L AH1 D , s, 
mine, M ǝ IH N, s, 
eyes, ǝ IH Z, s, 
no, N OW :, s, 
tears, T EH1 R Z , s, 
and, AH0 N D , s, 
maine, M EH: : N, s, 
myself, M AY2 S EH1 L F , s, 
did, D IH1 D , s, 
win, W IH1 N , s, 
them, DH EH1 M , s, 
both, B OW : TH, s, 
those, DH OW1 Z , s, 
provinces, P R AA1 V AH0 N S AH0 Z , s, 
these, DH IY1 Z , s, 
arms, AA1 R M Z , s, 
of, AH1 V , s, 
mine, M ǝ IH N, s, 
did, D IH1 D , s, 
conquer, K AA1 NG K ER0 , s, 
and, AH0 N D , s, 
are, AA1 R , s, 
the, DH AH0 , s, 
cities, S IH1 T IY0 Z , s, 
that, DH AE1 T , s, 
i, AY1 , s, 
got, G AA1 T , s, 
with, W IH1 DH , s, 
wounds, W UW1 N D Z , s, 
delivered, D IH ˈ L IH V ǝ R D, s, 
up, AH1 P , s, 
again, ǝ ˈ ɡ EH: : N, s, 
with, W IH1 DH , s, 
peaceful, P IY1 S F AH0 L , s, 
words, W ER1 D Z , s, 
mort, M AO : R T, s, 
dieu, D Y ø, s, 
so, S OW :, s, 
god, G AA1 D , s, 
help, e L P, s, 
warwick, ˈ W ɒ r IH K, s, 
as, AE1 Z , s, 
he, HH IY1 , s, 
loves, L ɤ V Z, s, 
the, DH AH0 , s, 
land, L AE1 N D , s, 
and, AH0 N D , s, 
common, K AA1 M AH0 N , s, 
profit, P R AA1 F AH0 T , s, 
of, AH1 V , s, 
his, HH IH1 Z , s, 
country, K AH1 N T R IY0 , s, 
unto, AH1 N T UW0 , s, 
the, DH AH0 , s, 
main, M EH: : N, s, 
o, OW :, s, 
father, F AA1 DH ER0 , s, 
maine, M EH: : N, s, 
is, IH1 Z , s, 
lost, L AO1 S T , s, 
that, DH AE1 T , s, 
maine, M EH: : N, s, 
which, ʍ IH T SH, s, 
by, B AY1 , s, 
main, M EH: : N, s, 
force, F AO : R S, s, 
warwick, ˈ W ɒ r IH K, s, 
did, D IH1 D , s, 
win, W IH1 N , s, 
and, AH0 N D , s, 
would, W UH1 D , s, 
have, HH AE1 V , s, 
kept, K EH1 P T , s, 
so, S OW :, s, 
long, L AO1 NG , s, 
as, AE1 Z , s, 
breath, B R EH1 TH , s, 
did, D IH1 D , s, 
last, L AE1 S T , s, 
main, M EH: : N, s, 
chance, CH AE1 N S , s, 
father, F AA1 DH ER0 , s, 
you, Y UW1 , s, 
meant, M EH1 N T , s, 
but, B AH1 T , s, 
i, AY1 , s, 
meant, M EH1 N T , s, 
maine, M EH: : N, s, 
which, ʍ IH T SH, s, 
i, AY1 , s, 
will, W IH1 L , s, 
win, W IH1 N , s, 
from, F R AH1 M , s, 
france, F r AW N S, s, 
or, AO : R, s, 
else, EH1 L S , s, 
be, B IY1 , s, 
slain, S L EH: : N, s, 
whether, W EH1 DH ER0 , s, 
your, Y AO1 R , s, 
grace, G r EH: : S, s, 
be, B IY1 , s, 
worthy, W ER1 DH IY0 , s, 
yea, Y EH: :, s, 
or, AO : R, s, 
no, N OW :, s, 
dispute, D IH0 S P Y UW1 T , s, 
not, N AA1 T , s, 
that, DH AE1 T , s, 
york, Y AO1 R K , s, 
is, IH1 Z , s, 
the, DH AH0 , s, 
worthier, W ER1 DH IY0 ER0 , s, 
the, DH AH0 , s, 
cardinal's, K AA1 R D AH0 N AH0 L Z , s, 
not, N AA1 T , s, 
my, M AY1 , s, 
better, ˈ B e T ə R, s, 
in, IH N, s, 
the, DH AH0 , s, 
field, F IY1 L D , s, 
warwick, ˈ W ɒ r IH K, s, 
may, M EH: :, s, 
live, L AY1 V , s, 
to, T UW1 , s, 
be, B IY1 , s, 
the, DH AH0 , s, 
best, B EH1 S T , s, 
of, AH1 V , s, 
all, AA : L, s, 
that, DH AE1 T , s, 
can, K AE1 N , s, 
i, AY1 , s, 
witness, W IH1 T N AH0 S , s, 
and, AH0 N D , s, 
a, AH0 , s, 
fouler, ˈ F ǝ UH L · ǝ R, s, 
fact, F AE1 K T , s, 
did, D IH1 D , s, 
never, ˈ N e V ǝ R, s, 
traitor, T R EY1 T ER0 , s, 
in, IH N, s, 
the, DH AH0 , s, 
land, L AE1 N D , s, 
commit, K AH0 M IH1 T , s, 
image, IH1 M AH0 JH , s, 
of, AH1 V , s, 
pride, P r ǝ IH D, s, 
why, ʍ ǝ IH, s, 
should, SH UH1 D , s, 
i, AY1 , s, 
hold, OW : L D, s, 
my, M AY1 , s, 
peace, P IY : S, s, 
sweet, S W IY1 T , s, 
york, Y AO1 R K , s, 
begin, B IH0 G IH1 N , s, 
and, AH0 N D , s, 
if, IH1 F , s, 
thy, DH AY1 , s, 
claim, K L EH: : M, s, 
be, B IY1 , s, 
good, G UH1 D , s, 
the, DH AH0 , s, 
are, AA1 R , s, 
thy, DH AY1 , s, 
subjects, S AH1 B JH IH0 K T S , s, 
to, T UW1 , s, 
command, K ǝ ˈ M AW N D, s, 
father, F AA1 DH ER0 , s, 
the, DH AH0 , s, 
duke, D UW1 K , s, 
hath, HH AE1 TH , s, 
told, T OW1 L D , s, 
the, DH AH0 , s, 
truth, T R UW1 TH , s, 
thus, DH ɤ S, s, 
got, G AA1 T , s, 
the, DH AH0 , s, 
house, ǝ UH Z, s, 
of, AH1 V , s, 
lancaster, ˈ L AW NG K AW S T ǝ R, s, 
the, DH AH0 , s, 
crown, K r ǝ UH N, s, 
what, W AH1 T , s, 
plain, P L EH: : N, s, 
proceedings, P R OW0 S IY1 D IH0 NG Z , s, 
is, IH1 Z , s, 
more, M AO1 R , s, 
plain, P L EH: : N, s, 
than, DH AE1 N , s, 
this, DH IH1 S , s, 
henry, HH EH1 N R IY0 , s, 
doth, D AO1 TH , s, 
claim, K L EH: : M, s, 
the, DH AH0 , s, 
crown, K r ǝ UH N, s, 
from, F R AH1 M , s, 
john, JH AA1 N , s, 
of, AH1 V , s, 
gaunt, G AO1 N T , s, 
the, DH AH0 , s, 
fourth, F AO1 R TH , s, 
son, S AO ̃, s, 
york, Y AO1 R K , s, 
claims, K L EY1 M Z , s, 
it, IH1 T , s, 
from, F R AH1 M , s, 
the, DH AH0 , s, 
third, TH ER1 D , s, 
till, T IH1 L , s, 
issue, ˈ IH S Y UW :, s, 
fails, F EH: : L Z, s, 
his, HH IH1 Z , s, 
should, SH UH1 D , s, 
not, N AA1 T , s, 
reign, r EH: : N, s, 
it, IH1 T , s, 
fails, F EH: : L Z, s, 
not, N AA1 T , s, 
yet, Y EH1 T , s, 
but, B AH1 T , s, 
flourishes, ˈ F L ɤ r IH SH IH Z, s, 
in, IH N, s, 
thee, DH IY1 , s, 
and, AH0 N D , s, 
in, IH N, s, 
thy, DH AY1 , s, 
sons, S AH1 N Z , s, 
fair, F EH: : R, s, 
slips, S L IH1 P S , s, 
of, AH1 V , s, 
such, S ɤ T SH, s, 
a, AH0 , s, 
stock, S T AA1 K , s, 
then, DH EH1 N , s, 
father, F AA1 DH ER0 , s, 
salisbury, ˈ S AA : L Z B r ǝ IH, s, 
kneel, N IY1 L , s, 
we, W IY1 , s, 
together, T AH0 G EH1 DH ER0 , s, 
and, AH0 N D , s, 
in, IH N, s, 
this, DH IH1 S , s, 
private, ˈ P r ǝ IH V ǝ T, s, 
plot, P L AA1 T , s, 
be, B IY1 , s, 
we, W IY1 , s, 
the, DH AH0 , s, 
first, F ER1 S T , s, 
that, DH AE1 T , s, 
shall, SH AE1 L , s, 
salute, S AH0 L UW1 T , s, 
our, OW : R, s, 
rightful, R AY1 T F AH0 L , s, 
sovereign, ˈ S ɒ V r ǝ N, s, 
with, W IH1 DH , s, 
honor, AA1 N ER0 , s, 
of, AH1 V , s, 
his, HH IH1 Z , s, 
birthright, B ER1 TH R AY2 T , s, 
to, T UW1 , s, 
the, DH AH0 , s, 
crown, K r ǝ UH N, s, 
long, L AO1 NG , s, 
live, L AY1 V , s, 
our, OW : R, s, 
sovereign, ˈ S ɒ V r ǝ N, s, 
richard, ˈ r IH T SH ǝ R D, s, 
england's, IH1 NG G L AH0 N D Z , s, 
king, K IH1 NG , s, 
my, M AY1 , s, 
heart, HH AA1 R T , s, 
assures, ǝ ˈ SH UW : R Z, s, 
me, M IY1 , s, 
that, DH AE1 T , s, 
the, DH AH0 , s, 
earl, ER1 L , s, 
of, AH1 V , s, 
warwick, ˈ W ɒ r IH K, s, 
shall, SH AE1 L , s, 
one, W AH1 N , s, 
day, D EY1 , s, 
make, M EH: : K, s, 
the, DH AH0 , s, 
duke, D UW1 K , s, 
of, AH1 V , s, 
york, Y AO1 R K , s, 
a, AH0 , s, 
king, K IH1 NG , s, 
it, IH1 T , s, 
is, IH1 Z , s, 
reported, R IY2 P AO1 R T IH0 D , s, 
mighty, ˈ M ǝ IH T ǝ IH, s, 
sovereign, ˈ S ɒ V r ǝ N, s, 
that, DH AE1 T , s, 
good, G UH1 D , s, 
duke, D UW1 K , s, 
humphrey, HH AH1 M F R IY0 , s, 
traitorously, ˈ T r EH: : T r ǝ S ˌ L ǝ IH, s, 
is, IH1 Z , s, 
murdered, ˈ M ɐ : R DH ǝ R D, s, 
by, B AY1 , s, 
suffolk, S AH1 F AH0 K , s, 
and, AH0 N D , s, 
the, DH AH0 , s, 
cardinal, K AA1 R D AH0 N AH0 L , s, 
means, M IY1 N Z , s, 
the, DH AH0 , s, 
commons, K AA1 M AH0 N Z , s, 
like, L ǝ IH K, s, 
an, AE1 N , s, 
angry, AE1 NG G R IY0 , s, 
hive, ǝ IH V, s, 
of, AH1 V , s, 
bees, B IY1 Z , s, 
that, DH AE1 T , s, 
want, W AA N T, s, 
their, DH EH1 R , s, 
leader, ˈ L IY : D ǝ R, s, 
scatter, ˈ S K AW T ǝ R, s, 
up, AH1 P , s, 
and, AH0 N D , s, 
down, D ǝ UH N, s, 
and, AH0 N D , s, 
care, K EH: : R, s, 
not, N AA1 T , s, 
who, HH UW1 , s, 
they, DH EY1 , s, 
sting, S T IH1 NG , s, 
in, IH N, s, 
his, HH IH1 Z , s, 
revenge, R IY0 V EH1 N JH , s, 
myself, M AY2 S EH1 L F , s, 
have, HH AE1 V , s, 
calmed, K AA1 M D , s, 
their, DH EH1 R , s, 
mutiny, ˈ M Y UW : T IH ˌ N ǝ IH, s, 
until, AH0 N T IH1 L , s, 
they, DH EY1 , s, 
hear, IY : R, s, 
the, DH AH0 , s, 
order, ˈ AO : R D ǝ R, s, 
of, AH1 V , s, 
his, HH IH1 Z , s, 
death, D EH1 TH , s, 
that, DH AE1 T , s, 
shall, SH AE1 L , s, 
i, AY1 , s, 
do, D OW :, s, 
my, M AY1 , s, 
salisbury, ˈ S AA : L Z B r ǝ IH, s, 
with, W IH1 DH , s, 
the, DH AH0 , s, 
rude, R UW1 D , s, 
multitude, M AH1 L T AH0 T UW2 D , s, 
till, T IH1 L , s, 
i, AY1 , s, 
return, r IH ˈ T ɐ : R N, s, 
come, K ɤ M, s, 
hither, ˈ IH DH ǝ R, s, 
gracious, ˈ G r EH: : S IH ǝ S, s, 
sovereign, ˈ S ɒ V r ǝ N, s, 
view, V Y UW1 , s, 
this, DH IH1 S , s, 
body, B AA1 D IY0 , s, 
as, AE1 Z , s, 
surely, SH UH1 R L IY0 , s, 
as, AE1 Z , s, 
my, M AY1 , s, 
soul, S OW1 L , s, 
intends, IH2 N T EH1 N D Z , s, 
to, T UW1 , s, 
live, L AY1 V , s, 
with, W IH1 DH , s, 
that, DH AE1 T , s, 
dread, D R EH1 D , s, 
king, K IH1 NG , s, 
that, DH AE1 T , s, 
took, T UH1 K , s, 
our, OW : R, s, 
state, S T EY1 T , s, 
upon, AH0 P AA1 N , s, 
him, HH IH1 M , s, 
to, T UW1 , s, 
free, F R IY1 , s, 
us, AH1 S , s, 
from, F R AH1 M , s, 
his, HH IH1 Z , s, 
father's, F AA1 DH ER0 Z , s, 
wrathful, ˈ r AW TH F UH L, s, 
curse, K ɐ : R S, s, 
i, AY1 , s, 
do, D OW :, s, 
believe, B IH0 L IY1 V , s, 
that, DH AE1 T , s, 
violent, ˈ V ǝ IH ǝ ˌ L e N T, s, 
hands, AW N D Z, s, 
were, W ER1 , s, 
laid, L EH: : D, s, 
upon, AH0 P AA1 N , s, 
the, DH AH0 , s, 
life, L AY1 F , s, 
of, AH1 V , s, 
this, DH IH1 S , s, 
duke, D UW1 K , s, 
see, S IY1 , s, 
how, HH AW1 , s, 
the, DH AH0 , s, 
blood, B L AH1 D , s, 
is, IH1 Z , s, 
settled, S EH1 T AH0 L D , s, 
in, IH N, s, 
his, HH IH1 Z , s, 
face, F EH: : S, s, 
oft, AO1 F T , s, 
have, HH AE1 V , s, 
i, AY1 , s, 
seen, S IY1 N , s, 
a, AH0 , s, 
timely-parted, ˈ T ǝ IH M L ǝ IH - ˌ P AA : R T IH D, s, 
ghost, G OW1 S T , s, 
of, AH1 V , s, 
ashy, ˈ AW SH ǝ IH, s, 
semblance, S EH1 M B L AH0 N S , s, 
meager, ˈ M IY : G ǝ R, s, 
pale, P EH: : L, s, 
and, AH0 N D , s, 
bloodless, ˈ B L ɤ D L ə S, s, 
being, B IY1 IH0 NG , s, 
all, AA : L, s, 
descended, D IH0 S EH1 N D AH0 D , s, 
to, T UW1 , s, 
the, DH AH0 , s, 
laboring, L EY1 B ER0 IH0 NG , s, 
heart, HH AA1 R T , s, 
who, HH UW1 , s, 
in, IH N, s, 
the, DH AH0 , s, 
conflict, ˈ K ɒ N F L IH K T, s, 
that, DH AE1 T , s, 
it, IH1 T , s, 
holds, OW : L D Z, s, 
with, W IH1 DH , s, 
death, D EH1 TH , s, 
attracts, AH0 T R AE1 K T S , s, 
the, DH AH0 , s, 
same, S EY1 M , s, 
for, F AO1 R , s, 
aidance, ˈ EH: : D ǝ N S, s, 
the, DH AH0 , s, 
enemy, EH1 N AH0 M IY0 , s, 
which, ʍ IH T SH, s, 
with, W IH1 DH , s, 
the, DH AH0 , s, 
heart, HH AA1 R T , s, 
there, DH EH1 R , s, 
cools, K UW1 L Z , s, 
and, AH0 N D , s, 
ne'er, N EH1 R , s, 
to, T UW1 , s, 
blush, B L ɤ SH, s, 
and, AH0 N D , s, 
beautify, ˈ B Y UW : T IH ˌ F ə IH, s, 
the, DH AH0 , s, 
cheek, CH IY1 K , s, 
again, ǝ ˈ ɡ EH: : N, s, 
but, B AH1 T , s, 
see, S IY1 , s, 
his, HH IH1 Z , s, 
face, F EH: : S, s, 
is, IH1 Z , s, 
black, B L AE1 K , s, 
and, AH0 N D , s, 
full, F UH1 L , s, 
of, AH1 V , s, 
blood, B L AH1 D , s, 
his, HH IH1 Z , s, 
eyeballs, AY1 B AO2 L Z , s, 
further, F ER1 DH ER0 , s, 
out, AW1 T , s, 
than, DH AE1 N , s, 
when, ʍ e N, s, 
he, HH IY1 , s, 
lived, L IH1 V D , s, 
staring, ˈ S T EH: : r IH N, s, 
full, F UH1 L , s, 
ghastly, G AE1 S T L IY0 , s, 
like, L ǝ IH K, s, 
a, AH0 , s, 
strangled, ˈ S T r AW NG G   - ǝ L D, s, 
man, M AE1 N , s, 
his, HH IH1 Z , s, 
hair, HH EH1 R , s, 
his, HH IH1 Z , s, 
nostrils, N AA1 S T R AH0 L Z , s, 
stretched, S T R EH1 CH T , s, 
with, W IH1 DH , s, 
struggling, ˈ S T r ɤ G   - L IH N, s, 
his, HH IH1 Z , s, 
hands, AW N D Z, s, 
abroad, AH0 B R AO1 D , s, 
displayed, D IH0 S P L EY1 D , s, 
as, AE1 Z , s, 
one, W AH1 N , s, 
that, DH AE1 T , s, 
grasped, G r AW S P T, s, 
and, AH0 N D , s, 
tugged, T AH1 G D , s, 
for, F AO1 R , s, 
life, L AY1 F , s, 
and, AH0 N D , s, 
was, W AA1 Z , s, 
by, B AY1 , s, 
strength, S T R EH1 NG K TH , s, 
subdued, S AH0 B D UW1 D , s, 
look, L UH1 K , s, 
on, AA1 N , s, 
the, DH AH0 , s, 
sheets, SH IY1 T S , s, 
his, HH IH1 Z , s, 
hair, HH EH1 R , s, 
you, Y UW1 , s, 
see, S IY1 , s, 
is, IH1 Z , s, 
sticking, ˈ S T IH K IH N, s, 
his, HH IH1 Z , s, 
beard, B EH: : R D, s, 
made, M EH: : D, s, 
rough, R AH1 F , s, 
and, AH0 N D , s, 
rugged, ˈ r ɤ G IH D, s, 
like, L ǝ IH K, s, 
to, T UW1 , s, 
the, DH AH0 , s, 
summer's, S AH1 M ER0 Z , s, 
corn, K AO1 R N , s, 
by, B AY1 , s, 
tempest, T EH1 M P AH0 S T , s, 
lodged, L AA1 JH D , s, 
it, IH1 T , s, 
cannot, K AE1 N AA0 T , s, 
be, B IY1 , s, 
but, B AH1 T , s, 
he, HH IY1 , s, 
was, W AA1 Z , s, 
murdered, ˈ M ɐ : R DH ǝ R D, s, 
here, HH IY1 R , s, 
the, DH AH0 , s, 
least, L IY1 S T , s, 
of, AH1 V , s, 
all, AA : L, s, 
these, DH IY1 Z , s, 
signs, S ǝ IH N Z, s, 
were, W ER1 , s, 
probable, P R AA1 B AH0 B AH0 L , s, 
but, B AH1 T , s, 
both, B OW : TH, s, 
of, AH1 V , s, 
you, Y UW1 , s, 
were, W ER1 , s, 
vowed, V ǝ UH IH D, s, 
duke, D UW1 K , s, 
humphrey's, HH AH1 M F R IY0 Z , s, 
foes, F OW1 Z , s, 
and, AH0 N D , s, 
you, Y UW1 , s, 
forsooth, F ǝ R ˈ S UW : TH, s, 
had, HH AE1 D , s, 
the, DH AH0 , s, 
good, G UH1 D , s, 
duke, D UW1 K , s, 
to, T UW1 , s, 
keep, K IY1 P , s, 
'tis, T IH1 Z , s, 
like, L ǝ IH K, s, 
you, Y UW1 , s, 
would, W UH1 D , s, 
not, N AA1 T , s, 
feast, F e S T, s, 
him, HH IH1 M , s, 
like, L ǝ IH K, s, 
a, AH0 , s, 
friend, F R EH1 N D , s, 
and, AH0 N D , s, 
'tis, T IH1 Z , s, 
well, W EH1 L , s, 
seen, S IY1 N , s, 
he, HH IY1 , s, 
found, F ǝ UH N D, s, 
an, AE1 N , s, 
enemy, EH1 N AH0 M IY0 , s, 
who, HH UW1 , s, 
finds, F ǝ IH N D Z, s, 
the, DH AH0 , s, 
heifer, HH AY1 F ER0 , s, 
dead, D EH1 D , s, 
and, AH0 N D , s, 
bleeding, ˈ B L IY : D IH N, s, 
fresh, F R EH1 SH , s, 
and, AH0 N D , s, 
sees, S IY1 Z , s, 
fast, F AW S T, s, 
by, B AY1 , s, 
a, AH0 , s, 
butcher, B UH1 CH ER0 , s, 
with, W IH1 DH , s, 
an, AE1 N , s, 
ax, AE1 K S , s, 
but, B AH1 T , s, 
will, W IH1 L , s, 
suspect, S ǝ ˈ S P e K T, s, 
'twas, T W AH1 Z , s, 
he, HH IY1 , s, 
that, DH AE1 T , s, 
made, M EH: : D, s, 
the, DH AH0 , s, 
slaughter, S L AO1 T ER0 , s, 
who, HH UW1 , s, 
finds, F ǝ IH N D Z, s, 
the, DH AH0 , s, 
partridge, ˈ P AA : R T r IH D ZH, s, 
in, IH N, s, 
the, DH AH0 , s, 
nest, N EH1 S T , s, 
but, B AH1 T , s, 
may, M EH: :, s, 
imagine, IH ˈ M AW D ZH IH N, s, 
how, HH AW1 , s, 
the, DH AH0 , s, 
bird, B ɐ : R D, s, 
was, W AA1 Z , s, 
dead, D EH1 D , s, 
although, AA : L ˈ DH OW :, s, 
the, DH AH0 , s, 
kite, K AY1 T , s, 
soar, S OW : R, s, 
with, W IH1 DH , s, 
beak, B IY1 K , s, 
even, IY1 V IH0 N , s, 
so, S OW :, s, 
suspicious, S ǝ ˈ S P IH S IH ǝ S, s, 
is, IH1 Z , s, 
this, DH IH1 S , s, 
tragedy, T R AE1 JH AH0 D IY0 , s, 
what, W AH1 T , s, 
dares, D EH: : R Z, s, 
not, N AA1 T , s, 
warwick, ˈ W ɒ r IH K, s, 
if, IH1 F , s, 
false, F AA L S, s, 
suffolk, S AH1 F AH0 K , s, 
dare, D EH: : R, s, 
him, HH IH1 M , s, 
madam, M AE1 D AH0 M , s, 
be, B IY1 , s, 
reverence, ˈ r e V r ǝ N S, s, 
may, M EH: :, s, 
i, AY1 , s, 
say, S EH: :, s, 
for, F AO1 R , s, 
every, ˈ e V r ǝ IH, s, 
word, W ER1 D , s, 
you, Y UW1 , s, 
speak, S P IY : K, s, 
in, IH N, s, 
his, HH IH1 Z , s, 
behalf, B IH0 HH AE1 F , s, 
is, IH1 Z , s, 
slander, ˈ S L AO : N D ǝ R, s, 
to, T UW1 , s, 
your, Y AO1 R , s, 
royal, ˈ r ǝ IH ǝ AA L, s, 
dignity, D IH1 G N AH0 T IY0 , s, 
but, B AH1 T , s, 
that, DH AE1 T , s, 
the, DH AH0 , s, 
guilt, G IH1 L T , s, 
of, AH1 V , s, 
murder, M ER1 D ER0 , s, 
bucklers, ˈ B ɤ K L ə R Z, s, 
thee, DH IY1 , s, 
and, AH0 N D , s, 
i, AY1 , s, 
should, SH UH1 D , s, 
rob, R AA1 B , s, 
the, DH AH0 , s, 
of, AH1 V , s, 
his, HH IH1 Z , s, 
fee, F IY1 , s, 
quitting, ˈ K W IH T IH N, s, 
thee, DH IY1 , s, 
thereby, DH EH: : R ˈ B ǝ IH, s, 
of, AH1 V , s, 
ten, T EH1 N , s, 
thousand, ˈ TH ǝ UH Z ǝ N D, s, 
shames, SH EY1 M Z , s, 
and, AH0 N D , s, 
that, DH AE1 T , s, 
my, M AY1 , s, 
presence, P R EH1 Z AH0 N S , s, 
makes, M EH: : K S, s, 
me, M IY1 , s, 
mild, M ǝ IH L D, s, 
i, AY1 , s, 
would, W UH1 D , s, 
false, F AA L S, s, 
coward, K AW1 ER0 D , s, 
on, AA1 N , s, 
thy, DH AY1 , s, 
knee, N IY1 , s, 
make, M EH: : K, s, 
thee, DH IY1 , s, 
beg, B EH1 G , s, 
pardon, ˈ P AA : R D ǝ N, s, 
for, F AO1 R , s, 
thy, DH AY1 , s, 
speech, S P IY1 CH , s, 
and, AH0 N D , s, 
say, S EH: :, s, 
it, IH1 T , s, 
was, W AA1 Z , s, 
thy, DH AY1 , s, 
mother, M AH1 DH ER0 , s, 
that, DH AE1 T , s, 
thou, DH AW1 , s, 
that, DH AE1 T , s, 
thou, DH AW1 , s, 
thyself, DH AY2 S EH1 L F , s, 
born, B AO : R N, s, 
in, IH N, s, 
and, AH0 N D , s, 
after, ˈ AW F T ǝ R, s, 
all, AA : L, s, 
this, DH IH1 S , s, 
fearful, F IH1 R F AH0 L , s, 
homage, ˈ ɒ M IH D ZH, s, 
done, D AH1 N , s, 
give, G IH1 V , s, 
thee, DH IY1 , s, 
thy, DH AY1 , s, 
hire, ǝ IH R, s, 
and, AH0 N D , s, 
send, S EH1 N D , s, 
thy, DH AY1 , s, 
soul, S OW1 L , s, 
to, T UW1 , s, 
hell, e L, s, 
pernicious, P ER0 N IH1 SH AH0 S , s, 
bloodsucker, B L AH1 D S AH2 K ER0 , s, 
of, AH1 V , s, 
sleeping, S L IY1 P IH0 NG , s, 
men, M EH1 N , s, 
away, ǝ ˈ W EH: :, s, 
even, IY1 V IH0 N , s, 
now, N AW1 , s, 
or, AO : R, s, 
i, AY1 , s, 
will, W IH1 L , s, 
drag, D R AE1 G , s, 
thee, DH IY1 , s, 
hence, HH EH1 N S , s, 
unworthy, AH0 N W ER1 DH IY0 , s, 
though, DH OW1 , s, 
thou, DH AW1 , s, 
art, AA : R T, s, 
i'll, AY1 L , s, 
cope, K OW1 P , s, 
with, W IH1 DH , s, 
thee, DH IY1 , s, 
and, AH0 N D , s, 
do, D OW :, s, 
some, S AH1 M , s, 
service, ˈ S ɐ : R V IH S, s, 
to, T UW1 , s, 
duke, D UW1 K , s, 
humphrey's, HH AH1 M F R IY0 Z , s, 
ghost, G OW1 S T , s, 
beaufort, B OW1 F ER0 T , s, 
it, IH1 T , s, 
is, IH1 Z , s, 
thy, DH AY1 , s, 
sovereign, ˈ S ɒ V r ǝ N, s, 
speaks, S P IY : K S, s, 
to, T UW1 , s, 
thee, DH IY1 , s, 
see, S IY1 , s, 
how, HH AW1 , s, 
the, DH AH0 , s, 
pangs, P AE1 NG Z , s, 
of, AH1 V , s, 
death, D EH1 TH , s, 
do, D OW :, s, 
make, M EH: : K, s, 
him, HH IH1 M , s, 
grin, G R IH1 N , s, 
so, S OW :, s, 
bad, B AE1 D , s, 
a, AH0 , s, 
death, D EH1 TH , s, 
argues, ˈ AA : R ɡ Y UW : Z, s, 
a, AH0 , s, 
monstrous, ˈ M ɒ N S T r ǝ, s, 
life, L AY1 F , s, 
you, Y UW1 , s, 
were, W ER1 , s, 
best, B EH1 S T , s, 
to, T UW1 , s, 
go, G OW :, s, 
to, T UW1 , s, 
bed, B EH1 D , s, 
and, AH0 N D , s, 
dream, D R IY1 M , s, 
again, ǝ ˈ ɡ EH: : N, s, 
to, T UW1 , s, 
keep, K IY1 P , s, 
thee, DH IY1 , s, 
from, F R AH1 M , s, 
the, DH AH0 , s, 
tempest, T EH1 M P AH0 S T , s, 
of, AH1 V , s, 
the, DH AH0 , s, 
field, F IY1 L D , s, 
now, N AW1 , s, 
by, B AY1 , s, 
my, M AY1 , s, 
father's, F AA1 DH ER0 Z , s, 
badge, B AE1 JH , s, 
old, OW : L D, s, 
crest, K R EH1 S T , s, 
the, DH AH0 , s, 
rampant, R AE1 M P AH0 N T , s, 
bear, B EH: : R, s, 
chained, T SH EH: : N D, s, 
to, T UW1 , s, 
the, DH AH0 , s, 
ragged, ˈ r AW G IH D, s, 
staff, S T AE1 F , s, 
this, DH IH1 S , s, 
day, D EY1 , s, 
i'll, AY1 L , s, 
wear, W EH: : R, s, 
aloft, AH0 L AO1 F T , s, 
my, M AY1 , s, 
burgonet, ˈ B ɐ : R ɡ ə ˌ N e T, s, 
as, AE1 Z , s, 
on, AA1 N , s, 
a, AH0 , s, 
mountaintop, M AW1 N T AH0 N T AA2 P , s, 
the, DH AH0 , s, 
cedar, S IY1 D ER0 , s, 
shows, SH OW : Z, s, 
that, DH AE1 T , s, 
keeps, K IY1 P S , s, 
his, HH IH1 Z , s, 
leaves, L IY1 V Z , s, 
in, IH N, s, 
spite, S P ǝ IH T, s, 
of, AH1 V , s, 
any, ˈ AW N ǝ IH, s, 
storm, S T AO : R M, s, 
even, IY1 V IH0 N , s, 
to, T UW1 , s, 
affright, ǝ ˈ F r ǝ IH T, s, 
thee, DH IY1 , s, 
with, W IH1 DH , s, 
the, DH AH0 , s, 
view, V Y UW1 , s, 
thereof, DH EH2 R AH1 V , s, 
clifford, K L IH1 F ER0 D , s, 
of, AH1 V , s, 
cumberland, K AH1 M B ER0 L AH0 N D , s, 
'tis, T IH1 Z , s, 
warwick, ˈ W ɒ r IH K, s, 
calls, K AO1 L Z , s, 
an, AE1 N , s, 
if, IH1 F , s, 
thou, DH AW1 , s, 
dost, D AA1 S T , s, 
not, N AA1 T , s, 
hide, ǝ IH D, s, 
thee, DH IY1 , s, 
from, F R AH1 M , s, 
the, DH AH0 , s, 
bear, B EH: : R, s, 
now, N AW1 , s, 
when, ʍ e N, s, 
the, DH AH0 , s, 
angry, AE1 NG G R IY0 , s, 
trumpet, T R AH1 M P AH0 T , s, 
sounds, S AW1 N D Z , s, 
alarum, ǝ ˈ L AA : r ǝ, s, 
and, AH0 N D , s, 
dead, D EH1 D , s, 
men's, M EH1 N Z , s, 
cries, K R AY1 Z , s, 
do, D OW :, s, 
fill, F IH1 L , s, 
the, DH AH0 , s, 
empty, ˈ e M T ǝ IH, s, 
air, EH: R, s, 
clifford, K L IH1 F ER0 D , s, 
i, AY1 , s, 
say, S EH: :, s, 
come, K ɤ M, s, 
forth, ˈ F AO : R TH, s, 
and, AH0 N D , s, 
fight, F ǝ IH T, s, 
with, W IH1 DH , s, 
me, M IY1 , s, 
proud, P r ǝ UH D, s, 
northern, ˈ N AO : R DH ǝ R N, s, 
lord, L AO : R D, s, 
clifford, K L IH1 F ER0 D , s, 
of, AH1 V , s, 
cumberland, K AH1 M B ER0 L AH0 N D , s, 
warwick, ˈ W ɒ r IH K, s, 
is, IH1 Z , s, 
hoarse, HH AO1 R S , s, 
with, W IH1 DH , s, 
calling, K AO1 L IH0 NG , s, 
thee, DH IY1 , s, 
to, T UW1 , s, 
arms, AA1 R M Z , s, 
how, HH AW1 , s, 
now, N AW1 , s, 
my, M AY1 , s, 
noble, ˈ N OW : B ǝ L, s, 
lord, L AO : R D, s, 
what, W AH1 T , s, 
all, AA : L, s, 
afoot, AH0 F UH1 T , s, 
of, AH1 V , s, 
one, W AH1 N , s, 
or, AO : R, s, 
both, B OW : TH, s, 
of, AH1 V , s, 
us, AH1 S , s, 
the, DH AH0 , s, 
time, T AY1 M , s, 
is, IH1 Z , s, 
come, K ɤ M, s, 
then, DH EH1 N , s, 
nobly, N AA1 B L IY0 , s, 
york, Y AO1 R K , s, 
'tis, T IH1 Z , s, 
for, F AO1 R , s, 
a, AH0 , s, 
crown, K r ǝ UH N, s, 
thou, DH AW1 , s, 
as, AE1 Z , s, 
i, AY1 , s, 
intend, IH2 N T EH1 N D , s, 
clifford, K L IH1 F ER0 D , s, 
to, T UW1 , s, 
thrive, TH R AY1 V , s, 
today, T AH0 D EY1 , s, 
it, IH1 T , s, 
grieves, G R IY1 V Z , s, 
my, M AY1 , s, 
soul, S OW1 L , s, 
to, T UW1 , s, 
leave, L IY1 V , s, 
thee, DH IY1 , s, 
after, ˈ AW F T ǝ R, s, 
them, DH EH1 M , s, 
nay, N EH: :, s, 
before, B IH0 F AO1 R , s, 
them, DH EH1 M , s, 
if, IH1 F , s, 
we, W IY1 , s, 
can, K AE1 N , s, 
now, N AW1 , s, 
by, B AY1 , s, 
my, M AY1 , s, 
hand, AW N D, s, 
lords, L AO1 R D Z , s, 
'twas, T W AH1 Z , s, 
a, AH0 , s, 
glorious, G L AO1 R IY0 AH0 S , s, 
day, D EY1 , s, 
saint, S EY1 N T , s, 
albans, AE1 L B AE0 N Z , s, 
battle, B AE1 T AH0 L , s, 
won, W ɤ N, s, 
by, B AY1 , s, 
famous, F EY1 M AH0 S , s, 
york, Y AO1 R K , s, 
shall, SH AE1 L , s, 
be, B IY1 , s, 
in, IH N, s, 
all, AA : L, s, 
age, EY1 JH , s, 
to, T UW1 , s, 
come, K ɤ M, s, 
sound, S ǝ UH N D, s, 
drum, D R AH1 M , s, 
and, AH0 N D , s, 
trumpets, T R AH1 M P AH0 T S , s, 
and, AH0 N D , s, 
to, T UW1 , s, 
london, L AH1 N D AH0 N , s, 
all, AA : L, s, 
and, AH0 N D , s, 
more, M AO1 R , s, 
such, S ɤ T SH, s, 
days, D EY1 Z , s, 
as, AE1 Z , s, 
these, DH IY1 Z , s, 
to, T UW1 , s, 
us, AH1 S , s, 
befall, B IH0 F AO1 L , s, 
long, L AO1 NG , s, 
live, L AY1 V , s, 
queen, K W IY1 N , s, 
margaret, M AA1 R G ER0 IH0 T , s, 
england's, IH1 NG G L AH0 N D Z , s, 
happiness, HH AE1 P IY0 N AH0 S , s, 
for, F AO1 R , s, 
grief, G R IY1 F , s, 
that, DH AE1 T , s, 
they, DH EY1 , s, 
are, AA1 R , s, 
past, P AW S T, s, 
recovery, r IH ˈ K ɤ V r ǝ IH, s, 
for, F AO1 R , s, 
were, W ER0 , s, 
there, DH EH1 R , s, 
hope, HH OW1 P , s, 
to, T UW1 , s, 
conquer, K AA1 NG K ER0 , s, 
them, DH EH1 M , s, 
again, ǝ ˈ ɡ EH: : N, s, 
my, M AY1 , s, 
sword, S AO1 R D , s, 
should, SH UH1 D , s, 
shed, SH EH1 D , s, 
hot, HH AA1 T , s, 
blood, B L AH1 D , s, 
mine, M ǝ IH N, s, 
eyes, ǝ IH Z, s, 
no, N OW :, s, 
tears, T EH1 R Z , s, 
and, AH0 N D , s, 
maine, M EH: : N, s, 
myself, M AY2 S EH1 L F , s, 
did, D IH1 D , s, 
win, W IH1 N , s, 
them, DH EH1 M , s, 
both, B OW : TH, s, 
those, DH OW1 Z , s, 
provinces, P R AA1 V AH0 N S AH0 Z , s, 
these, DH IY1 Z , s, 
arms, AA1 R M Z , s, 
of, AH1 V , s, 
mine, M ǝ IH N, s, 
did, D IH1 D , s, 
conquer, K AA1 NG K ER0 , s, 
and, AH0 N D , s, 
are, AA1 R , s, 
the, DH AH0 , s, 
cities, S IH1 T IY0 Z , s, 
that, DH AE1 T , s, 
i, AY1 , s, 
got, G AA1 T , s, 
with, W IH1 DH , s, 
wounds, W UW1 N D Z , s, 
delivered, D IH ˈ L IH V ǝ R D, s, 
up, AH1 P , s, 
again, ǝ ˈ ɡ EH: : N, s, 
with, W IH1 DH , s, 
peaceful, P IY1 S F AH0 L , s, 
words, W ER1 D Z , s, 
mort, M AO : R T, s, 
dieu, D Y ø, s, 
so, S OW :, s, 
god, G AA1 D , s, 
help, e L P, s, 
warwick, ˈ W ɒ r IH K, s, 
as, AE1 Z , s, 
he, HH IY1 , s, 
loves, L ɤ V Z, s, 
the, DH AH0 , s, 
land, L AE1 N D , s, 
and, AH0 N D , s, 
common, K AA1 M AH0 N , s, 
profit, P R AA1 F AH0 T , s, 
of, AH1 V , s, 
his, HH IH1 Z , s, 
country, K AH1 N T R IY0 , s, 
unto, AH1 N T UW0 , s, 
the, DH AH0 , s, 
main, M EH: : N, s, 
o, OW :, s, 
father, F AA1 DH ER0 , s, 
maine, M EH: : N, s, 
is, IH1 Z , s, 
lost, L AO1 S T , s, 
that, DH AE1 T , s, 
maine, M EH: : N, s, 
which, ʍ IH T SH, s, 
by, B AY1 , s, 
main, M EH: : N, s, 
force, F AO : R S, s, 
warwick, ˈ W ɒ r IH K, s, 
did, D IH1 D , s, 
win, W IH1 N , s, 
and, AH0 N D , s, 
would, W UH1 D , s, 
have, HH AE1 V , s, 
kept, K EH1 P T , s, 
so, S OW :, s, 
long, L AO1 NG , s, 
as, AE1 Z , s, 
breath, B R EH1 TH , s, 
did, D IH1 D , s, 
last, L AE1 S T , s, 
main, M EH: : N, s, 
chance, CH AE1 N S , s, 
father, F AA1 DH ER0 , s, 
you, Y UW1 , s, 
meant, M EH1 N T , s, 
but, B AH1 T , s, 
i, AY1 , s, 
meant, M EH1 N T , s, 
maine, M EH: : N, s, 
which, ʍ IH T SH, s, 
i, AY1 , s, 
will, W IH1 L , s, 
win, W IH1 N , s, 
from, F R AH1 M , s, 
france, F r AW N S, s, 
or, AO : R, s, 
else, EH1 L S , s, 
be, B IY1 , s, 
slain, S L EH: : N, s, 
whether, W EH1 DH ER0 , s, 
your, Y AO1 R , s, 
grace, G r EH: : S, s, 
be, B IY1 , s, 
worthy, W ER1 DH IY0 , s, 
yea, Y EH: :, s, 
or, AO : R, s, 
no, N OW :, s, 
dispute, D IH0 S P Y UW1 T , s, 
not, N AA1 T , s, 
that, DH AE1 T , s, 
york, Y AO1 R K , s, 
is, IH1 Z , s, 
the, DH AH0 , s, 
worthier, W ER1 DH IY0 ER0 , s, 
the, DH AH0 , s, 
cardinal's, K AA1 R D AH0 N AH0 L Z , s, 
not, N AA1 T , s, 
my, M AY1 , s, 
better, ˈ B e T ə R, s, 
in, IH N, s, 
the, DH AH0 , s, 
field, F IY1 L D , s, 
warwick, ˈ W ɒ r IH K, s, 
may, M EH: :, s, 
live, L AY1 V , s, 
to, T UW1 , s, 
be, B IY1 , s, 
