a, AH0 , s, 
goodly, ˈ G UH D L ǝ IH, s, 
day, D EY1 , s, 
not, N AA1 T , s, 
to, T UW1 , s, 
keep, K IY1 P , s, 
house, ǝ UH Z, s, 
with, W IH1 DH , s, 
such, S ɤ T SH, s, 
whose, HH UW1 Z , s, 
as, AE1 Z , s, 
low, L OW :, s, 
as, AE1 Z , s, 
ours, OW : R Z, s, 
stoop, S T UW1 P , s, 
boys, B OY1 Z , s, 
this, DH IH1 S , s, 
gate, G EH: : T, s, 
instructs, IH2 N S T R AH1 K T S , s, 
you, Y UW1 , s, 
how, HH AW1 , s, 
adore, AH0 D AO1 R , s, 
the, DH AH0 , s, 
heavens, HH EH1 V AH0 N Z , s, 
and, AH0 N D , s, 
bows, B OW : Z, s, 
you, Y UW1 , s, 
to, T UW1 , s, 
a, AH0 , s, 
morning's, M AO1 R N IH0 NG Z , s, 
holy, HH OW1 L IY0 , s, 
office, AO1 F IH0 S , s, 
the, DH AH0 , s, 
gates, G EH: : T S, s, 
of, AH1 V , s, 
monarchs, M AA1 N AA2 R K S , s, 
are, AA1 R , s, 
arched, AA : R T SH T, s, 
so, S OW :, s, 
high, ǝ IH, s, 
that, DH AE1 T , s, 
giants, JH AY1 AH0 N T S , s, 
may, M EH: :, s, 
jet, JH EH1 T , s, 
through, TH R UW1 , s, 
and, AH0 N D , s, 
keep, K IY1 P , s, 
their, DH EH1 R , s, 
impious, IH2 M P AY1 AH0 S , s, 
turbans, T ER1 B AH0 N Z , s, 
on, AA1 N , s, 
without, ˈ W IH DH ǝ UH T, s, 
good, G UH1 D , s, 
morrow, ˈ M ɒ r ǝ, s, 
to, T UW1 , s, 
the, DH AH0 , s, 
sun, S AH1 N , s, 
hail, HH EY1 L , s, 
thou, DH AW1 , s, 
fair, F EH: : R, s, 
heaven, HH EH1 V AH0 N , s, 
we, W IY1 , s, 
house, ǝ UH Z, s, 
rock, R AA1 K , s, 
yet, Y EH1 T , s, 
use, Y UW1 S , s, 
thee, DH IY1 , s, 
not, N AA1 T , s, 
so, S OW :, s, 
hardly, HH AA1 R D L IY0 , s, 
as, AE1 Z , s, 
prouder, P R AW1 D ER0 , s, 
livers, L IH1 V ER0 Z , s, 
do, D OW :, s, 
now, N AW1 , s, 
for, F AO1 R , s, 
our, OW : R, s, 
mountain, M AW1 N T AH0 N , s, 
sport, S P AO : R T, s, 
up, AH1 P , s, 
to, T UW1 , s, 
hill, IH L, s, 
your, Y AO1 R , s, 
legs, L EH1 G Z , s, 
are, AA1 R , s, 
young, ˈ Y ɒ NG, s, 
i'll, AY1 L , s, 
tread, T R EH1 D , s, 
these, DH IY1 Z , s, 
flats, F L AE1 T S , s, 
consider, K AH0 N S IH1 D ER0 , s, 
when, ʍ e N, s, 
you, Y UW1 , s, 
above, ǝ ˈ B ɤ V, s, 
perceive, P ER0 S IY1 V , s, 
me, M IY1 , s, 
like, L ǝ IH K, s, 
a, AH0 , s, 
crow, K r OW :, s, 
that, DH AE1 T , s, 
it, IH1 T , s, 
is, IH1 Z , s, 
place, P L EH: : S, s, 
which, ʍ IH T SH, s, 
lessens, L EH1 S AH0 N Z , s, 
and, AH0 N D , s, 
sets, S EH1 T S , s, 
off, AO1 F , s, 
and, AH0 N D , s, 
you, Y UW1 , s, 
may, M EH: :, s, 
then, DH EH1 N , s, 
revolve, R IY0 V AA1 L V , s, 
what, W AH1 T , s, 
tales, T EH: : L Z, s, 
i, AY1 , s, 
have, HH AE1 V , s, 
told, T OW1 L D , s, 
you, Y UW1 , s, 
of, AH1 V , s, 
courts, K AO : R T S, s, 
of, AH1 V , s, 
princes, P R IH1 N S AH0 Z , s, 
of, AH1 V , s, 
the, DH AH0 , s, 
tricks, T R IH1 K S , s, 
in, IH N, s, 
war, W AO1 R , s, 
this, DH IH1 S , s, 
service, ˈ S ɐ : R V IH S, s, 
is, IH1 Z , s, 
not, N AA1 T , s, 
service, ˈ S ɐ : R V IH S, s, 
so, S OW :, s, 
being, B IY1 IH0 NG , s, 
done, D AH1 N , s, 
but, B AH1 T , s, 
being, B IY1 IH0 NG , s, 
so, S OW :, s, 
allowed, AH0 L AW1 D , s, 
to, T UW1 , s, 
apprehend, ˌ AW P r IH ˈ e N D, s, 
thus, DH ɤ S, s, 
draws, D R AO1 Z , s, 
us, AH1 S , s, 
a, AH0 , s, 
profit, P R AA1 F AH0 T , s, 
from, F R AH1 M , s, 
all, AA : L, s, 
things, TH IH1 NG Z , s, 
we, W IY1 , s, 
see, S IY1 , s, 
and, AH0 N D , s, 
often, AO1 F AH0 N , s, 
to, T UW1 , s, 
our, OW : R, s, 
comfort, ˈ K ɤ M F ǝ R T, s, 
shall, SH AE1 L , s, 
we, W IY1 , s, 
find, F ǝ IH N D, s, 
the, DH AH0 , s, 
beetle, B IY1 T AH0 L , s, 
in, IH N, s, 
a, AH0 , s, 
safer, ˈ S EH: : F · ǝ R, s, 
hold, OW : L D, s, 
than, DH AE1 N , s, 
is, IH1 Z , s, 
the, DH AH0 , s, 
eagle, IY1 G AH0 L , s, 
o, OW :, s, 
this, DH IH1 S , s, 
life, L AY1 F , s, 
is, IH1 Z , s, 
nobler, ˈ N OW : B L ǝ R, s, 
than, DH AE1 N , s, 
attending, AH0 T EH1 N D IH0 NG , s, 
for, F AO1 R , s, 
a, AH0 , s, 
check, CH EH1 K , s, 
richer, R IH1 CH ER0 , s, 
than, DH AE1 N , s, 
doing, ˈ D UW : IH N, s, 
nothing, N AH1 TH IH0 NG , s, 
for, F AO1 R , s, 
a, AH0 , s, 
robe, r OW : B, s, 
prouder, P R AW1 D ER0 , s, 
than, DH AE1 N , s, 
rustling, ˈ r ɤ S L IH N, s, 
in, IH N, s, 
silk, S IH1 L K , s, 
such, S ɤ T SH, s, 
gain, G EH: : N, s, 
the, DH AH0 , s, 
cap, K AE1 P , s, 
of, AH1 V , s, 
him, HH IH1 M , s, 
that, DH AE1 T , s, 
makes, M EH: : K S, s, 
him, HH IH1 M , s, 
fine, F ǝ IH N, s, 
yet, Y EH1 T , s, 
keeps, K IY1 P S , s, 
his, HH IH1 Z , s, 
book, B UH1 K , s, 
no, N OW :, s, 
life, L AY1 F , s, 
to, T UW1 , s, 
ours, OW : R Z, s, 
how, HH AW1 , s, 
you, Y UW1 , s, 
speak, S P IY : K, s, 
did, D IH1 D , s, 
you, Y UW1 , s, 
but, B AH1 T , s, 
know, N OW1 , s, 
the, DH AH0 , s, 
city's, S IH1 T IY0 Z , s, 
usuries, ˈ Y UW : Z Y ǝ r ǝ IH Z, s, 
and, AH0 N D , s, 
felt, F EH1 L T , s, 
them, DH EH1 M , s, 
knowingly, ˈ N OW : IH N L ǝ IH, s, 
the, DH AH0 , s, 
art, AA : R T, s, 
o', OW1 , s, 
court, K AO : R T, s, 
as, AE1 Z , s, 
hard, AA : R D, s, 
to, T UW1 , s, 
leave, L IY1 V , s, 
as, AE1 Z , s, 
keep, K IY1 P , s, 
whose, HH UW1 Z , s, 
top, T AA1 P , s, 
to, T UW1 , s, 
climb, K L AY1 M , s, 
is, IH1 Z , s, 
certain, ˈ S ɐ : R T ǝ N, s, 
falling, F AA : L IH N, s, 
or, AO : R, s, 
so, S OW :, s, 
that, DH AE1 T , s, 
the, DH AH0 , s, 
as, AE1 Z , s, 
bad, B AE1 D , s, 
as, AE1 Z , s, 
falling, F AA : L IH N, s, 
the, DH AH0 , s, 
toil, T ǝ IH L, s, 
o', OW1 , s, 
war, W AO1 R , s, 
a, AH0 , s, 
pain, P EH: : N, s, 
that, DH AE1 T , s, 
only, OW1 N L IY0 , s, 
seems, S IY1 M Z , s, 
to, T UW1 , s, 
seek, S IY1 K , s, 
out, AW1 T , s, 
danger, ˈ D EH: : N D ZH ǝ R, s, 
name, N EH: : M, s, 
of, AH1 V , s, 
fame, F EH: : M, s, 
and, AH0 N D , s, 
honor, AA1 N ER0 , s, 
which, ʍ IH T SH, s, 
dies, ˈ D IY : e Z, s, 
search, S ɐ : R T SH, s, 
and, AH0 N D , s, 
hath, HH AE1 TH , s, 
as, AE1 Z , s, 
oft, AO1 F T , s, 
a, AH0 , s, 
epitaph, EH1 P AH0 T AE2 F , s, 
as, AE1 Z , s, 
record, r IH ˈ K AO : R D, s, 
of, AH1 V , s, 
fair, F EH: : R, s, 
many, ˈ M AW N ǝ IH, s, 
times, T AY1 M Z , s, 
doth, D AO1 TH , s, 
ill, IH1 L , s, 
deserve, D IH ˈ Z ɐ : R V, s, 
by, B AY1 , s, 
doing, ˈ D UW : IH N, s, 
well, W EH1 L , s, 
what's, W AH1 T S , s, 
worse, W AO : R S, s, 
must, M AH1 S T , s, 
curtsy, ˈ K ɐ : R T S ǝ IH, s, 
at, AE1 T , s, 
the, DH AH0 , s, 
censure, ˈ S e N S Y ǝ R, s, 
o, OW :, s, 
boys, B OY1 Z , s, 
this, DH IH1 S , s, 
story, S T AO1 R IY0 , s, 
the, DH AH0 , s, 
world, W ER1 L D , s, 
may, M EH: :, s, 
read, r e D, s, 
in, IH N, s, 
me, M IY1 , s, 
my, M AY1 , s, 
body's, B AA1 D IY0 Z , s, 
marked, M AA1 R K T , s, 
with, W IH1 DH , s, 
roman, ˈ r OW : M ǝ N, s, 
swords, S AO1 R D Z , s, 
and, AH0 N D , s, 
my, M AY1 , s, 
report, r IH ˈ P AO : R T, s, 
was, W AA1 Z , s, 
once, W AH1 N S , s, 
first, F ER1 S T , s, 
with, W IH1 DH , s, 
the, DH AH0 , s, 
best, B EH1 S T , s, 
of, AH1 V , s, 
note, N OW : T, s, 
cymbeline, ˈ S IH M B ǝ L IY : N, s, 
loved, L ɤ V D, s, 
me, M IY1 , s, 
and, AH0 N D , s, 
when, ʍ e N, s, 
a, AH0 , s, 
soldier, S OW1 L JH ER0 , s, 
was, W AA1 Z , s, 
the, DH AH0 , s, 
theme, TH IY1 M , s, 
my, M AY1 , s, 
name, N EH: : M, s, 
was, W AA1 Z , s, 
not, N AA1 T , s, 
far, F AA1 R , s, 
off, AO1 F , s, 
then, DH EH1 N , s, 
was, W AA1 Z , s, 
i, AY1 , s, 
as, AE1 Z , s, 
a, AH0 , s, 
tree, T R IY1 , s, 
whose, HH UW1 Z , s, 
boughs, B AW1 Z , s, 
did, D IH1 D , s, 
bend, B EH1 N D , s, 
with, W IH1 DH , s, 
fruit, F R UW1 T , s, 
but, B AH1 T , s, 
in, IH N, s, 
one, W AH1 N , s, 
night, N AY1 T , s, 
a, AH0 , s, 
storm, S T AO : R M, s, 
or, AO : R, s, 
robbery, ˈ r ɒ B r ǝ IH, s, 
call, K AO1 L , s, 
it, IH1 T , s, 
what, W AH1 T , s, 
you, Y UW1 , s, 
will, W IH1 L , s, 
shook, SH UH1 K , s, 
down, D ǝ UH N, s, 
my, M AY1 , s, 
mellow, ˈ M e L ǝ, s, 
hangings, ˈ AW NG G IH N Z, s, 
nay, N EH: :, s, 
my, M AY1 , s, 
leaves, L IY1 V Z , s, 
and, AH0 N D , s, 
left, L EH1 F T , s, 
me, M IY1 , s, 
bare, B AA : R, s, 
to, T UW1 , s, 
weather, W EH1 DH ER0 , s, 
my, M AY1 , s, 
fault, F AO1 L T , s, 
being, B IY1 IH0 NG , s, 
nothing, N AH1 TH IH0 NG , s, 
as, AE1 Z , s, 
i, AY1 , s, 
have, HH AE1 V , s, 
told, T OW1 L D , s, 
you, Y UW1 , s, 
oft, AO1 F T , s, 
but, B AH1 T , s, 
that, DH AE1 T , s, 
two, T UW1 , s, 
villains, V IH1 L AH0 N Z , s, 
whose, HH UW1 Z , s, 
false, F AA L S, s, 
oaths, OW1 DH Z , s, 
prevailed, P R IH0 V EY1 L D , s, 
before, B IH0 F AO1 R , s, 
my, M AY1 , s, 
perfect, ˈ P ɐ : R F IH T, s, 
honor, AA1 N ER0 , s, 
swore, S W AO1 R , s, 
to, T UW1 , s, 
cymbeline, ˈ S IH M B ǝ L IY : N, s, 
i, AY1 , s, 
was, W AA1 Z , s, 
confederate, K ǝ N ˈ F e D r ǝ T, s, 
with, W IH1 DH , s, 
the, DH AH0 , s, 
romans, R OW1 M AH0 N Z , s, 
so, S OW :, s, 
followed, F AA1 L OW0 D , s, 
my, M AY1 , s, 
banishment, B AE1 N IH0 SH M AH0 N T , s, 
and, AH0 N D , s, 
this, DH IH1 S , s, 
twenty, ˈ T W e N T ǝ IH, s, 
years, Y IH1 R Z , s, 
this, DH IH1 S , s, 
rock, R AA1 K , s, 
and, AH0 N D , s, 
these, DH IY1 Z , s, 
have, HH AE1 V , s, 
been, B IH1 N , s, 
my, M AY1 , s, 
world, W ER1 L D , s, 
where, ʍ EH: : R, s, 
i, AY1 , s, 
have, HH AE1 V , s, 
lived, L IH1 V D , s, 
at, AE1 T , s, 
honest, AA1 N AH0 S T , s, 
freedom, F R IY1 D AH0 M , s, 
paid, P EY1 D , s, 
more, M AO1 R , s, 
pious, ˈ P ǝ IH ǝ S, s, 
debts, D EH1 T S , s, 
to, T UW1 , s, 
heaven, HH EH1 V AH0 N , s, 
than, DH AE1 N , s, 
in, IH N, s, 
all, AA : L, s, 
the, DH AH0 , s, 
fore-end, ˈ F AO : R - ˌ e N D, s, 
of, AH1 V , s, 
my, M AY1 , s, 
time, T AY1 M , s, 
but, B AH1 T , s, 
up, AH1 P , s, 
to, T UW1 , s, 
mountains, M AW1 N T AH0 N Z , s, 
this, DH IH1 S , s, 
is, IH1 Z , s, 
not, N AA1 T , s, 
language, ˈ L AW NG G W IH D ZH, s, 
he, HH IY1 , s, 
that, DH AE1 T , s, 
strikes, ǝ IH K S, s, 
the, DH AH0 , s, 
venison, V EH1 N AH0 S AH0 N , s, 
first, F ER1 S T , s, 
shall, SH AE1 L , s, 
be, B IY1 , s, 
the, DH AH0 , s, 
lord, L AO : R D, s, 
o', OW1 , s, 
feast, F e S T, s, 
to, T UW1 , s, 
him, HH IH1 M , s, 
the, DH AH0 , s, 
other, AH1 DH ER0 , s, 
two, T UW1 , s, 
shall, SH AE1 L , s, 
minister, ˈ M IH N IH S T ǝ R, s, 
and, AH0 N D , s, 
we, W IY1 , s, 
will, W IH1 L , s, 
fear, F IY : R, s, 
no, N OW :, s, 
poison, ˈ P ǝ IH Z ǝ N, s, 
which, ʍ IH T SH, s, 
attends, AH0 T EH1 N D Z , s, 
in, IH N, s, 
place, P L EH: : S, s, 
of, AH1 V , s, 
greater, ˈ G r e T ǝ R, s, 
state, S T EY1 T , s, 
i'll, AY1 L , s, 
meet, M IY1 T , s, 
you, Y UW1 , s, 
in, IH N, s, 
the, DH AH0 , s, 
valleys, ˈ V AW L ǝ IH Z, s, 
how, HH AW1 , s, 
hard, AA : R D, s, 
it, IH1 T , s, 
is, IH1 Z , s, 
to, T UW1 , s, 
hide, ǝ IH D, s, 
the, DH AH0 , s, 
sparks, S P AA1 R K S , s, 
of, AH1 V , s, 
nature, N EY1 CH ER0 , s, 
these, DH IY1 Z , s, 
boys, B OY1 Z , s, 
know, N OW1 , s, 
little, L IH1 T AH0 L , s, 
they, DH EY1 , s, 
are, AA1 R , s, 
sons, S AH1 N Z , s, 
to, T UW1 , s, 
king, K IH1 NG , s, 
nor, N AO1 R , s, 
cymbeline, ˈ S IH M B ǝ L IY : N, s, 
dreams, D R IY1 M Z , s, 
that, DH AE1 T , s, 
they, DH EY1 , s, 
are, AA1 R , s, 
alive, AH0 L AY1 V , s, 
they, DH EY1 , s, 
think, TH IH1 NG K , s, 
they, DH EY1 , s, 
are, AA1 R , s, 
mine, M ǝ IH N, s, 
and, AH0 N D , s, 
though, DH OW1 , s, 
trained, T r EH: : N D, s, 
up, AH1 P , s, 
thus, DH ɤ S, s, 
cave, K EH: : V, s, 
wherein, ʍ EH: : R ˈ IH N, s, 
they, DH EY1 , s, 
bow, B OW :, s, 
their, DH EH1 R , s, 
thoughts, TH AO1 T S , s, 
do, D OW :, s, 
hit, IH T, s, 
the, DH AH0 , s, 
roofs, R UW1 F S , s, 
of, AH1 V , s, 
palaces, P AE1 L AH0 S AH0 Z , s, 
and, AH0 N D , s, 
nature, N EY1 CH ER0 , s, 
prompts, P R AA1 M P T S , s, 
them, DH EH1 M , s, 
in, IH N, s, 
simple, S IH1 M P AH0 L , s, 
and, AH0 N D , s, 
low, L OW :, s, 
things, TH IH1 NG Z , s, 
to, T UW1 , s, 
prince, P R IH1 N S , s, 
it, IH1 T , s, 
much, M ɤ T SH, s, 
beyond, B IH0 AA1 N D , s, 
the, DH AH0 , s, 
trick, T R IH1 K , s, 
of, AH1 V , s, 
others, AH1 DH ER0 Z , s, 
this, DH IH1 S , s, 
the, DH AH0 , s, 
heir, EH1 R , s, 
of, AH1 V , s, 
cymbeline, ˈ S IH M B ǝ L IY : N, s, 
and, AH0 N D , s, 
britain, B R IH1 T AH0 N , s, 
who, HH UW1 , s, 
the, DH AH0 , s, 
king, K IH1 NG , s, 
his, HH IH1 Z , s, 
father, F AA1 DH ER0 , s, 
called, K AO1 L D , s, 
when, ʍ e N, s, 
on, AA1 N , s, 
my, M AY1 , s, 
stool, S T UW1 L , s, 
i, AY1 , s, 
sit, S IH1 T , s, 
and, AH0 N D , s, 
tell, T EH1 L , s, 
the, DH AH0 , s, 
warlike, ˈ W AA : R L ǝ IH K, s, 
feats, F IY1 T S , s, 
i, AY1 , s, 
have, HH AE1 V , s, 
done, D AH1 N , s, 
his, HH IH1 Z , s, 
spirits, S P IH1 R IH0 T S , s, 
fly, F L ǝ IH, s, 
out, AW1 T , s, 
into, IH1 N T UW0 , s, 
my, M AY1 , s, 
story, S T AO1 R IY0 , s, 
say, S EH: :, s, 
thus, DH ɤ S, s, 
mine, M ǝ IH N, s, 
enemy, EH1 N AH0 M IY0 , s, 
fell, F EH1 L , s, 
and, AH0 N D , s, 
thus, DH ɤ S, s, 
i, AY1 , s, 
set, S EH1 T , s, 
my, M AY1 , s, 
foot, F UH1 T , s, 
on, AA1 N , s, 
's, EH1 S , s, 
neck, N EH1 K , s, 
even, IY1 V IH0 N , s, 
then, DH EH1 N , s, 
the, DH AH0 , s, 
princely, ˈ P r IH N S L ǝ IH, s, 
blood, B L AH1 D , s, 
flows, F L OW : Z, s, 
in, IH N, s, 
his, HH IH1 Z , s, 
cheek, CH IY1 K , s, 
he, HH IY1 , s, 
sweats, S W EH1 T S , s, 
strains, EH: : N Z, s, 
his, HH IH1 Z , s, 
young, ˈ Y ɒ NG, s, 
nerves, ˈ N ɐ : R V Z, s, 
and, AH0 N D , s, 
puts, P UH1 T S , s, 
himself, HH IH0 M S EH1 L F , s, 
in, IH N, s, 
posture, P AA1 S CH ER0 , s, 
that, DH AE1 T , s, 
acts, AE1 K T S , s, 
my, M AY1 , s, 
words, W ER1 D Z , s, 
the, DH AH0 , s, 
younger, Y AH1 NG G ER0 , s, 
brother, B R AH1 DH ER0 , s, 
once, W AH1 N S , s, 
arviragus, ˌ AA : R V IH ˈ r AW ɡ ǝ S, s, 
in, IH N, s, 
as, AE1 Z , s, 
like, L ǝ IH K, s, 
a, AH0 , s, 
figure, ˈ F IH G ǝ R, s, 
strikes, ǝ IH K S, s, 
life, L AY1 F , s, 
into, IH1 N T UW0 , s, 
my, M AY1 , s, 
speech, S P IY1 CH , s, 
and, AH0 N D , s, 
shows, SH OW : Z, s, 
much, M ɤ T SH, s, 
more, M AO1 R , s, 
his, HH IH1 Z , s, 
own, OW : N, s, 
conceiving, K ǝ N ˈ S IY : V IH N, s, 
hark, AA : R K, s, 
the, DH AH0 , s, 
game, G EH: : M, s, 
is, IH1 Z , s, 
roused, ˈ r ǝ UH Z IH D, s, 
o, OW :, s, 
cymbeline, ˈ S IH M B ǝ L IY : N, s, 
heaven, HH EH1 V AH0 N , s, 
and, AH0 N D , s, 
my, M AY1 , s, 
conscience, ˈ K ɒ N S IH ǝ N S, s, 
knows, N OW1 Z , s, 
thou, DH AW1 , s, 
unjustly, ɤ N ˈ D ZH ɤ S T L ǝ IH, s, 
banish, B AE1 N IH0 SH , s, 
me, M IY1 , s, 
at, AE1 T , s, 
three, TH R IY1 , s, 
and, AH0 N D , s, 
two, T UW1 , s, 
years, Y IH1 R Z , s, 
old, OW : L D, s, 
i, AY1 , s, 
stole, S T OW : L, s, 
these, DH IY1 Z , s, 
babes, B EY1 B Z , s, 
thinking, ˈ TH IH NG K IH N, s, 
to, T UW1 , s, 
bar, B AA : R, s, 
thee, DH IY1 , s, 
of, AH1 V , s, 
succession, S ǝ K ˈ S e S IH ǝ N, s, 
as, AE1 Z , s, 
thou, DH AW1 , s, 
me, M IY1 , s, 
of, AH1 V , s, 
my, M AY1 , s, 
lands, L AE1 N D Z , s, 
thou, DH AW1 , s, 
their, DH EH1 R , s, 
nurse, N ER1 S , s, 
they, DH EY1 , s, 
took, T UH1 K , s, 
thee, DH IY1 , s, 
for, F AO1 R , s, 
their, DH EH1 R , s, 
mother, M AH1 DH ER0 , s, 
and, AH0 N D , s, 
every, ˈ e V r ǝ IH, s, 
day, D EY1 , s, 
do, D OW :, s, 
honor, AA1 N ER0 , s, 
to, T UW1 , s, 
her, HH ER1 , s, 
grave, G r EH: : V, s, 
myself, M AY2 S EH1 L F , s, 
belarius, B IH ˈ L AW r IH ə S, s, 
that, DH AE1 T , s, 
am, AE1 M , s, 
morgan, ˈ M AO : R G ǝ N, s, 
called, K AO1 L D , s, 
they, DH EY1 , s, 
take, T EY1 K , s, 
for, F AO1 R , s, 
natural, ˈ N AW T r AA L, s, 
father, F AA1 DH ER0 , s, 
the, DH AH0 , s, 
game, G EH: : M, s, 
is, IH1 Z , s, 
up, AH1 P , s, 
you, Y UW1 , s, 
have, HH AE1 V , s, 
proved, P r ɤ V D, s, 
best, B EH1 S T , s, 
woodman, W UH1 D M AH0 N , s, 
and, AH0 N D , s, 
are, AA1 R , s, 
master, ˈ M AW S T ǝ R, s, 
of, AH1 V , s, 
the, DH AH0 , s, 
feast, F e S T, s, 
and, AH0 N D , s, 
i, AY1 , s, 
will, W IH1 L , s, 
play, P L EH: :, s, 
the, DH AH0 , s, 
cook, K UH1 K , s, 
and, AH0 N D , s, 
servant, ˈ S ɐ : R V ǝ N T, s, 
'tis, T IH1 Z , s, 
our, OW : R, s, 
match, M AE1 CH , s, 
the, DH AH0 , s, 
sweat, S W EH1 T , s, 
of, AH1 V , s, 
industry, ˈ IH N D ɤ S T r ǝ IH, s, 
would, W UH1 D , s, 
dry, D r ǝ IH, s, 
and, AH0 N D , s, 
die, D ǝ IH, s, 
but, B AH1 T , s, 
for, F AO1 R , s, 
the, DH AH0 , s, 
end, EH1 N D , s, 
it, IH1 T , s, 
works, W AO : R K S, s, 
to, T UW1 , s, 
come, K ɤ M, s, 
our, OW : R, s, 
stomachs, S T AH1 M AH0 K S , s, 
will, W IH1 L , s, 
make, M EH: : K, s, 
what's, W AH1 T S , s, 
homely, ˈ OW : M L ǝ IH, s, 
savory, S EY1 V ER0 IY0 , s, 
weariness, W IH1 R IY0 N AH0 S , s, 
can, K AE1 N , s, 
snore, S N AO : R, s, 
upon, AH0 P AA1 N , s, 
the, DH AH0 , s, 
flint, F L IH1 N T , s, 
when, ʍ e N, s, 
sloth, S L OW1 TH , s, 
finds, F ǝ IH N D Z, s, 
the, DH AH0 , s, 
down, D ǝ UH N, s, 
pillow, ˈ P IH L ǝ, s, 
hard, AA : R D, s, 
now, N AW1 , s, 
peace, P IY : S, s, 
be, B IY1 , s, 
here, HH IY1 R , s, 
poor, P UW1 R , s, 
house, ǝ UH Z, s, 
that, DH AE1 T , s, 
thyself, DH AY2 S EH1 L F , s, 
stay, S T EH: :, s, 
come, K ɤ M, s, 
not, N AA1 T , s, 
in, IH N, s, 
but, B AH1 T , s, 
that, DH AE1 T , s, 
it, IH1 T , s, 
eats, IY : T S, s, 
our, OW : R, s, 
victuals, ˈ V IH T L Z, s, 
i, AY1 , s, 
should, SH UH1 D , s, 
think, TH IH1 NG K , s, 
here, HH IY1 R , s, 
were, W ER1 , s, 
a, AH0 , s, 
fairy, F EH1 R IY0 , s, 
by, B AY1 , s, 
jupiter, ˈ D ZH UW : P IH T ǝ R, s, 
an, AE1 N , s, 
angel, EY1 N JH AH0 L , s, 
or, AO : R, s, 
if, IH1 F , s, 
not, N AA1 T , s, 
an, AE1 N , s, 
earthly, ER1 TH L IY0 , s, 
paragon, ˈ P AW r ǝ ˌ G ɒ N, s, 
behold, B IH0 HH OW1 L D , s, 
divineness, D IH ˈ V ǝ IH N ǝ S, s, 
no, N OW :, s, 
elder, ˈ e L D ǝ R, s, 
than, DH AE1 N , s, 
a, AH0 , s, 
boy, B OY1 , s, 
whither, W IH1 DH ER0 , s, 
bound, B ə UH N D Z, s, 
what's, W AH1 T S , s, 
your, Y AO1 R , s, 
name, N EH: : M, s, 
prithee, ˈ P r e DH IY :, s, 
fair, F EH: : R, s, 
youth, Y UW1 TH , s, 
think, TH IH1 NG K , s, 
us, AH1 S , s, 
no, N OW :, s, 
nor, N AO1 R , s, 
measure, ˈ M e Z ǝ R, s, 
our, OW : R, s, 
good, G UH1 D , s, 
minds, M ǝ IH N D Z, s, 
by, B AY1 , s, 
this, DH IH1 S , s, 
rude, R UW1 D , s, 
place, P L EH: : S, s, 
we, W IY1 , s, 
live, L AY1 V , s, 
in, IH N, s, 
well, W EH1 L , s, 
encountered, IH0 N K AW1 N T ER0 D , s, 
'tis, T IH1 Z , s, 
almost, ˈ AA : L M OW : S T, s, 
night, N AY1 T , s, 
you, Y UW1 , s, 
shall, SH AE1 L , s, 
have, HH AE1 V , s, 
better, ˈ B e T ə R, s, 
cheer, T SH IY : R, s, 
ere, EH: : R, s, 
you, Y UW1 , s, 
depart, D IH ˈ P AA : R T, s, 
and, AH0 N D , s, 
thanks, TH AE1 NG K S , s, 
to, T UW1 , s, 
stay, S T EH: :, s, 
and, AH0 N D , s, 
eat, IY : T, s, 
it, IH1 T , s, 
boys, B OY1 Z , s, 
bid, B IH1 D , s, 
him, HH IH1 M , s, 
welcome, W EH1 L K AH0 M , s, 
he, HH IY1 , s, 
at, AE1 T , s, 
some, S AH1 M , s, 
distress, D IH0 S T R EH1 S , s, 
hark, AA : R K, s, 
boys, B OY1 Z , s, 
it, IH1 T , s, 
shall, SH AE1 L , s, 
be, B IY1 , s, 
so, S OW :, s, 
boys, B OY1 Z , s, 
we'll, W IY1 L , s, 
go, G OW :, s, 
dress, D R EH1 S , s, 
our, OW : R, s, 
youth, Y UW1 TH , s, 
come, K ɤ M, s, 
in, IH N, s, 
discourse, D IH S ˈ K AO : R S, s, 
is, IH1 Z , s, 
heavy, ˈ e V ǝ IH, s, 
fasting, F AE1 S T IH0 NG , s, 
when, ʍ e N, s, 
we, W IY1 , s, 
have, HH AE1 V , s, 
we'll, W IY1 L , s, 
demand, D IH ˈ M AW N D, s, 
thee, DH IY1 , s, 
of, AH1 V , s, 
thy, DH AY1 , s, 
story, S T AO1 R IY0 , s, 
so, S OW :, s, 
far, F AA1 R , s, 
as, AE1 Z , s, 
thou, DH AW1 , s, 
wilt, W IH1 L T , s, 
speak, S P IY : K, s, 
it, IH1 T , s, 
you, Y UW1 , s, 
are, AA1 R , s, 
not, N AA1 T , s, 
well, W EH1 L , s, 
remain, r IH ˈ M EH: : N, s, 
here, HH IY1 R , s, 
in, IH N, s, 
the, DH AH0 , s, 
cave, K EH: : V, s, 
we'll, W IY1 L , s, 
come, K ɤ M, s, 
to, T UW1 , s, 
you, Y UW1 , s, 
after, ˈ AW F T ǝ R, s, 
hunting, ˈ ɤ N T IH N, s, 
what, W AH1 T , s, 
how, HH AW1 , s, 
how, HH AW1 , s, 
o, OW :, s, 
noble, ˈ N OW : B ǝ L, s, 
strain, EH: : N, s, 
o, OW :, s, 
worthiness, ˈ W AO : R DH IH ˌ N e S, s, 
of, AH1 V , s, 
nature, N EY1 CH ER0 , s, 
breed, B R IY1 D , s, 
of, AH1 V , s, 
greatness, ˈ G r e T N ǝ S, s, 
cowards, K AW1 ER0 D Z , s, 
father, F AA1 DH ER0 , s, 
cowards, K AW1 ER0 D Z , s, 
and, AH0 N D , s, 
base, B AW S, s, 
things, TH IH1 NG Z , s, 
sire, S ǝ IH R, s, 
base, B AW S, s, 
nature, N EY1 CH ER0 , s, 
hath, HH AE1 TH , s, 
meal, M IY1 L , s, 
and, AH0 N D , s, 
bran, B R AE1 N , s, 
contempt, K ǝ N ˈ T e M T, s, 
and, AH0 N D , s, 
grace, G r EH: : S, s, 
i'm, AY1 M , s, 
not, N AA1 T , s, 
their, DH EH1 R , s, 
father, F AA1 DH ER0 , s, 
yet, Y EH1 T , s, 
who, HH UW1 , s, 
this, DH IH1 S , s, 
should, SH UH1 D , s, 
be, B IY1 , s, 
doth, D AO1 TH , s, 
miracle, ˈ M IH r ǝ ˌ K ɤ L, s, 
itself, IH2 T S EH1 L F , s, 
loved, L ɤ V D, s, 
before, B IH0 F AO1 R , s, 
me, M IY1 , s, 
'tis, T IH1 Z , s, 
the, DH AH0 , s, 
ninth, N AY1 N TH , s, 
hour, AW1 ER0 , s, 
o', OW1 , s, 
morn, M AO : R N, s, 
to, T UW1 , s, 
field, F IY1 L D , s, 
to, T UW1 , s, 
field, F IY1 L D , s, 
we'll, W IY1 L , s, 
leave, L IY1 V , s, 
you, Y UW1 , s, 
for, F AO1 R , s, 
this, DH IH1 S , s, 
time, T AY1 M , s, 
go, G OW :, s, 
in, IH N, s, 
and, AH0 N D , s, 
rest, R EH1 S T , s, 
pray, P r EH: :, s, 
be, B IY1 , s, 
not, N AA1 T , s, 
sick, S IH1 K , s, 
for, F AO1 R , s, 
you, Y UW1 , s, 
must, M AH1 S T , s, 
be, B IY1 , s, 
our, OW : R, s, 
and, AH0 N D , s, 
shalt, SH AE1 L T , s, 
be, B IY1 , s, 
ever, EH1 V ER0 , s, 
this, DH IH1 S , s, 
youth, Y UW1 TH , s, 
distressed, D IH S ˈ T r e S IH D, s, 
appears, ǝ ˈ P IY : R Z, s, 
he, HH IY1 , s, 
hath, HH AE1 TH , s, 
had, HH AE1 D , s, 
good, G UH1 D , s, 
ancestors, AE1 N S EH2 S T ER0 Z , s, 
it, IH1 T , s, 
is, IH1 Z , s, 
great, G r e T, s, 
morning, ˈ M AO : R N IH N, s, 
come, K ɤ M, s, 
away, ǝ ˈ W EH: :, s, 
who's, HH UW1 Z , s, 
there, DH EH1 R , s, 
those, DH OW1 Z , s, 
runagates, ˈ r ɤ N ǝ ˌ G EH: : T ǝ G EH: : T S, s, 
means, M IY1 N Z , s, 
he, HH IY1 , s, 
not, N AA1 T , s, 
us, AH1 S , s, 
i, AY1 , s, 
partly, P AA1 R T L IY0 , s, 
know, N OW1 , s, 
him, HH IH1 M , s, 
'tis, T IH1 Z , s, 
the, DH AH0 , s, 
son, S AO ̃, s, 
o', OW1 , s, 
queen, K W IY1 N , s, 
i, AY1 , s, 
fear, F IY : R, s, 
some, S AH1 M , s, 
ambush, AE1 M B UH2 SH , s, 
i, AY1 , s, 
saw, S AO1 , s, 
him, HH IH1 M , s, 
not, N AA1 T , s, 
these, DH IY1 Z , s, 
many, ˈ M AW N ǝ IH, s, 
years, Y IH1 R Z , s, 
and, AH0 N D , s, 
yet, Y EH1 T , s, 
i, AY1 , s, 
know, N OW1 , s, 
'tis, T IH1 Z , s, 
he, HH IY1 , s, 
we, W IY1 , s, 
are, AA1 R , s, 
held, HH EH1 L D , s, 
as, AE1 Z , s, 
outlaws, ˈ ǝ UH T L AO : Z, s, 
hence, HH EH1 N S , s, 
no, N OW :, s, 
company's, K AH1 M P AH0 N IY0 Z , s, 
abroad, AH0 B R AO1 D , s, 
i, AY1 , s, 
cannot, K AE1 N AA0 T , s, 
tell, T EH1 L , s, 
long, L AO1 NG , s, 
is, IH1 Z , s, 
it, IH1 T , s, 
since, S IH1 N S , s, 
i, AY1 , s, 
saw, S AO1 , s, 
him, HH IH1 M , s, 
but, B AH1 T , s, 
time, T AY1 M , s, 
hath, HH AE1 TH , s, 
nothing, N AH1 TH IH0 NG , s, 
blurred, B L ɐ : R D, s, 
those, DH OW1 Z , s, 
lines, L ǝ IH N Z, s, 
of, AH1 V , s, 
favor, F EY1 V ER0 , s, 
which, ʍ IH T SH, s, 
then, DH EH1 N , s, 
he, HH IY1 , s, 
wore, W AO1 R , s, 
the, DH AH0 , s, 
snatches, S N AE1 CH IH0 Z , s, 
in, IH N, s, 
his, HH IH1 Z , s, 
voice, V ǝ IH S, s, 
and, AH0 N D , s, 
burst, B ɐ : R S T, s, 
of, AH1 V , s, 
speaking, S P IY : K IH N, s, 
were, W ER1 , s, 
as, AE1 Z , s, 
his, HH IH1 Z , s, 
i, AY1 , s, 
am, AE1 M , s, 
absolute, ˈ AW B S ǝ ˌ L UW : T, s, 
'twas, T W AH1 Z , s, 
very, V EH1 R IY0 , s, 
being, B IY1 IH0 NG , s, 
scarce, S K EH1 R S , s, 
made, M EH: : D, s, 
up, AH1 P , s, 
i, AY1 , s, 
mean, M IY1 N , s, 
to, T UW1 , s, 
man, M AE1 N , s, 
he, HH IY1 , s, 
had, HH AE1 D , s, 
not, N AA1 T , s, 
apprehension, AE2 P R IH0 HH EH1 N SH AH0 N , s, 
of, AH1 V , s, 
roaring, R AO1 R IH0 NG , s, 
terrors, ˈ T e r ǝ R Z, s, 
for, F AO1 R , s, 
defect, D IH ˈ F e K T, s, 
of, AH1 V , s, 
judgment, JH AH1 JH M AH0 N T , s, 
is, IH1 Z , s, 
oft, AO1 F T , s, 
the, DH AH0 , s, 
cause, K AA1 Z , s, 
of, AH1 V , s, 
fear, F IY : R, s, 
but, B AH1 T , s, 
see, S IY1 , s, 
thy, DH AY1 , s, 
brother, B R AH1 DH ER0 , s, 
what, W AH1 T , s, 
hast, HH AE1 S T , s, 
thou, DH AW1 , s, 
done, D AH1 N , s, 
we, W IY1 , s, 
are, AA1 R , s, 
all, AA : L, s, 
undone, AH0 N D AH1 N , s, 
no, N OW :, s, 
single, S IH1 NG G AH0 L , s, 
soul, S OW1 L , s, 
can, K AE1 N , s, 
we, W IY1 , s, 
set, S EH1 T , s, 
eye, ǝ IH, s, 
on, AA1 N , s, 
but, B AH1 T , s, 
in, IH N, s, 
all, AA : L, s, 
safe, S EH: : F, s, 
reason, ˈ r EH: : Z ǝ N, s, 
he, HH IY1 , s, 
must, M AH1 S T , s, 
have, HH AE1 V , s, 
some, S AH1 M , s, 
attendants, AH0 T EH1 N D AH0 N T S , s, 
though, DH OW1 , s, 
his, HH IH1 Z , s, 
humor, HH Y UW1 M ER0 , s, 
was, W AA1 Z , s, 
nothing, N AH1 TH IH0 NG , s, 
but, B AH1 T , s, 
and, AH0 N D , s, 
that, DH AE1 T , s, 
from, F R AH1 M , s, 
one, W AH1 N , s, 
bad, B AE1 D , s, 
thing, TH IH1 NG , s, 
to, T UW1 , s, 
frenzy, ˈ F r e N Z ǝ IH, s, 
not, N AA1 T , s, 
absolute, ˈ AW B S ǝ ˌ L UW : T, s, 
madness, M AE1 D N AH0 S , s, 
could, K UH1 D , s, 
so, S OW :, s, 
far, F AA1 R , s, 
have, HH AE1 V , s, 
raved, R EY1 V D , s, 
to, T UW1 , s, 
bring, B R IH1 NG , s, 
him, HH IH1 M , s, 
here, HH IY1 R , s, 
alone, ǝ ˈ L OW : N, s, 
although, AA : L ˈ DH OW :, s, 
perhaps, P ER0 HH AE1 P S , s, 
it, IH1 T , s, 
may, M EH: :, s, 
be, B IY1 , s, 
heard, EH: : R D, s, 
at, AE1 T , s, 
court, K AO : R T, s, 
that, DH AE1 T , s, 
such, S ɤ T SH, s, 
as, AE1 Z , s, 
we, W IY1 , s, 
cave, K EH: : V, s, 
here, HH IY1 R , s, 
hunt, ɤ N T, s, 
here, HH IY1 R , s, 
are, AA1 R , s, 
outlaws, ˈ ǝ UH T L AO : Z, s, 
and, AH0 N D , s, 
in, IH N, s, 
time, T AY1 M , s, 
may, M EH: :, s, 
make, M EH: : K, s, 
some, S AH1 M , s, 
stronger, ˈ S T r ɒ NG G ǝ R, s, 
head, e D, s, 
the, DH AH0 , s, 
which, ʍ IH T SH, s, 
he, HH IY1 , s, 
hearing, ˈ IY : r IH N, s, 
as, AE1 Z , s, 
it, IH1 T , s, 
is, IH1 Z , s, 
like, L ǝ IH K, s, 
break, B R EY1 K , s, 
out, AW1 T , s, 
and, AH0 N D , s, 
