i, AY1 , s, 
sicker, ˈ S IH K ǝ R, s, 
be, B IY1 , s, 
now, N AW1 , s, 
he, HH IY1 , s, 
that, DH AE1 T , s, 
made, M EH: : D, s, 
me, M IY1 , s, 
knows, N OW1 Z , s, 
i, AY1 , s, 
see, S IY1 , s, 
thee, DH IY1 , s, 
ill, IH1 L , s, 
ill, IH1 L , s, 
in, IH N, s, 
myself, M AY2 S EH1 L F , s, 
to, T UW1 , s, 
see, S IY1 , s, 
and, AH0 N D , s, 
in, IH N, s, 
thee, DH IY1 , s, 
seeing, ˈ S IY : IH N, s, 
ill, IH1 L , s, 
thy, DH AY1 , s, 
deathbed, D EH1 TH B EH2 D , s, 
is, IH1 Z , s, 
no, N OW :, s, 
lesser, ˈ L e S ǝ R, s, 
than, DH AE1 N , s, 
thy, DH AY1 , s, 
land, L AE1 N D , s, 
wherein, ʍ EH: : R ˈ IH N, s, 
thou, DH AW1 , s, 
in, IH N, s, 
reputation, ˌ r e P Y ǝ ˈ T EH: : S IH ǝ N, s, 
sick, S IH1 K , s, 
and, AH0 N D , s, 
thou, DH AW1 , s, 
too, T UW1 , s, 
as, AE1 Z , s, 
thou, DH AW1 , s, 
art, AA : R T, s, 
thy, DH AY1 , s, 
anointed, ǝ ˈ N ǝ IH N T IH D, s, 
body, B AA1 D IY0 , s, 
to, T UW1 , s, 
the, DH AH0 , s, 
cure, K Y UW : R, s, 
of, AH1 V , s, 
those, DH OW1 Z , s, 
physicians, F AH0 Z IH1 SH AH0 N Z , s, 
that, DH AE1 T , s, 
first, F ER1 S T , s, 
wounded, W ǝ UH N D IH D, s, 
thee, DH IY1 , s, 
a, AH0 , s, 
thousand, ˈ TH ǝ UH Z ǝ N D, s, 
sit, S IH1 T , s, 
within, W IH0 DH IH1 N , s, 
thy, DH AY1 , s, 
crown, K r ǝ UH N, s, 
whose, HH UW1 Z , s, 
compass, ˈ K ɤ M P ǝ S, s, 
is, IH1 Z , s, 
no, N OW :, s, 
bigger, B IH1 G ER0 , s, 
than, DH AE1 N , s, 
thy, DH AY1 , s, 
head, e D, s, 
and, AH0 N D , s, 
yet, Y EH1 T , s, 
in, IH N, s, 
so, S OW :, s, 
small, S M AO1 L , s, 
a, AH0 , s, 
verge, V ER1 JH , s, 
the, DH AH0 , s, 
waste, W AW S T, s, 
is, IH1 Z , s, 
no, N OW :, s, 
whit, W IH1 T , s, 
lesser, ˈ L e S ǝ R, s, 
than, DH AE1 N , s, 
thy, DH AY1 , s, 
land, L AE1 N D , s, 
o, OW :, s, 
had, HH AE1 D , s, 
thy, DH AY1 , s, 
grandsire, ˈ G r AW N ˌ S ǝ IH R, s, 
with, W IH1 DH , s, 
a, AH0 , s, 
eye, ǝ IH, s, 
seen, S IY1 N , s, 
how, HH AW1 , s, 
his, HH IH1 Z , s, 
son's, S AH1 N Z , s, 
son, S AO ̃, s, 
should, SH UH1 D , s, 
destroy, D IH ˈ S T r ǝ IH, s, 
his, HH IH1 Z , s, 
sons, S AH1 N Z , s, 
from, F R AH1 M , s, 
forth, ˈ F AO : R TH, s, 
thy, DH AY1 , s, 
reach, R IY1 CH , s, 
he, HH IY1 , s, 
would, W UH1 D , s, 
have, HH AE1 V , s, 
laid, L EH: : D, s, 
thy, DH AY1 , s, 
shame, SH EY1 M , s, 
deposing, D IH ˈ P OW : Z IH N, s, 
thee, DH IY1 , s, 
before, B IH0 F AO1 R , s, 
thou, DH AW1 , s, 
wert, W ER1 T , s, 
possessed, P AH0 Z EH1 S T , s, 
which, ʍ IH T SH, s, 
art, AA : R T, s, 
possessed, P AH0 Z EH1 S T , s, 
now, N AW1 , s, 
to, T UW1 , s, 
depose, D IH ˈ P OW : Z, s, 
thyself, DH AY2 S EH1 L F , s, 
why, ʍ ǝ IH, s, 
cousin, K AH1 Z AH0 N , s, 
wert, W ER1 T , s, 
thou, DH AW1 , s, 
regent, R IY1 JH AH0 N T , s, 
of, AH1 V , s, 
the, DH AH0 , s, 
world, W ER1 L D , s, 
it, IH1 T , s, 
were, W ER1 , s, 
a, AH0 , s, 
shame, SH EY1 M , s, 
to, T UW1 , s, 
let, L EH1 T , s, 
this, DH IH1 S , s, 
land, L AE1 N D , s, 
by, B AY1 , s, 
lease, L IY : S, s, 
but, B AH1 T , s, 
for, F AO1 R , s, 
thy, DH AY1 , s, 
world, W ER1 L D , s, 
enjoying, e N ˈ D ZH ǝ IH IH N, s, 
but, B AH1 T , s, 
this, DH IH1 S , s, 
land, L AE1 N D , s, 
is, IH1 Z , s, 
it, IH1 T , s, 
not, N AA1 T , s, 
more, M AO1 R , s, 
than, DH AE1 N , s, 
shame, SH EY1 M , s, 
to, T UW1 , s, 
shame, SH EY1 M , s, 
it, IH1 T , s, 
so, S OW :, s, 
landlord, L AE1 N D L AO2 R D , s, 
of, AH1 V , s, 
england, IH1 NG G L AH0 N D , s, 
art, AA : R T, s, 
thou, DH AW1 , s, 
now, N AW1 , s, 
not, N AA1 T , s, 
king, K IH1 NG , s, 
thy, DH AY1 , s, 
state, S T EY1 T , s, 
of, AH1 V , s, 
law, L AO1 , s, 
is, IH1 Z , s, 
bondslave, ˈ B ɒ N D S L EH: : V, s, 
to, T UW1 , s, 
the, DH AH0 , s, 
law, L AO1 , s, 
and, AH0 N D , s, 
thou, DH AW1 , s, 
o, OW :, s, 
spare, S P EH: : R, s, 
me, M IY1 , s, 
not, N AA1 T , s, 
my, M AY1 , s, 
brother, B R AH1 DH ER0 , s, 
edward's, EH1 D W ER0 D Z , s, 
son, S AO ̃, s, 
for, F AO1 R , s, 
that, DH AE1 T , s, 
i, AY1 , s, 
was, W AA1 Z , s, 
his, HH IH1 Z , s, 
father, F AA1 DH ER0 , s, 
edward's, EH1 D W ER0 D Z , s, 
son, S AO ̃, s, 
that, DH AE1 T , s, 
blood, B L AH1 D , s, 
already, AA : L ˈ r e D ǝ IH, s, 
like, L ǝ IH K, s, 
the, DH AH0 , s, 
pelican, P EH1 L AH0 K AH0 N , s, 
hast, HH AE1 S T , s, 
thou, DH AW1 , s, 
tapped, T AE1 P T , s, 
out, AW1 T , s, 
and, AH0 N D , s, 
drunkenly, ˈ D r ɤ NG K ǝ N L ǝ IH, s, 
my, M AY1 , s, 
brother, B R AH1 DH ER0 , s, 
well-meaning, ˈ W e L - ˈ M IY : N IH N, s, 
soul, S OW1 L , s, 
whom, HH UW1 M , s, 
fair, F EH: : R, s, 
befall, B IH0 F AO1 L , s, 
in, IH N, s, 
heaven, HH EH1 V AH0 N , s, 
happy, ˈ AW P ǝ IH, s, 
souls, S OW1 L Z , s, 
may, M EH: :, s, 
be, B IY1 , s, 
a, AH0 , s, 
precedent, ˈ P r e S IH ˌ D e N T, s, 
and, AH0 N D , s, 
witness, W IH1 T N AH0 S , s, 
good, G UH1 D , s, 
that, DH AE1 T , s, 
thou, DH AW1 , s, 
not, N AA1 T , s, 
spilling, S P IH1 L IH0 NG , s, 
edward's, EH1 D W ER0 D Z , s, 
blood, B L AH1 D , s, 
join, JH OY1 N , s, 
with, W IH1 DH , s, 
the, DH AH0 , s, 
present, P r IH ˈ Z e N T, s, 
sickness, S IH1 K N AH0 S , s, 
that, DH AE1 T , s, 
i, AY1 , s, 
have, HH AE1 V , s, 
and, AH0 N D , s, 
thy, DH AY1 , s, 
unkindness, ɤ N ˈ K ǝ IH N D N ǝ S, s, 
be, B IY1 , s, 
like, L ǝ IH K, s, 
crooked, K R UH1 K AH0 D , s, 
age, EY1 JH , s, 
to, T UW1 , s, 
crop, K R AA1 P , s, 
at, AE1 T , s, 
once, W AH1 N S , s, 
a, AH0 , s, 
withered, ˈ W IH DH ǝ R D, s, 
flower, F L AW1 ER0 , s, 
live, L AY1 V , s, 
in, IH N, s, 
thy, DH AY1 , s, 
shame, SH EY1 M , s, 
but, B AH1 T , s, 
die, D ǝ IH, s, 
not, N AA1 T , s, 
shame, SH EY1 M , s, 
with, W IH1 DH , s, 
thee, DH IY1 , s, 
these, DH IY1 Z , s, 
words, W ER1 D Z , s, 
hereafter, HH IH0 R AE1 F T ER0 , s, 
thy, DH AY1 , s, 
tormentors, T AO1 R M EH2 N T ER0 Z , s, 
be, B IY1 , s, 
convey, K ǝ N ˈ V EH: :, s, 
me, M IY1 , s, 
to, T UW1 , s, 
my, M AY1 , s, 
bed, B EH1 D , s, 
then, DH EH1 N , s, 
to, T UW1 , s, 
my, M AY1 , s, 
grave, G r EH: : V, s, 
love, L ɤ V, s, 
they, DH EY1 , s, 
to, T UW1 , s, 
live, L AY1 V , s, 
that, DH AE1 T , s, 
love, L ɤ V, s, 
and, AH0 N D , s, 
honor, AA1 N ER0 , s, 
have, HH AE1 V , s, 
i, AY1 , s, 
have, HH AE1 V , s, 
my, M AY1 , s, 
liege, L IY1 JH , s, 
as, AE1 Z , s, 
near, N IY : R, s, 
as, AE1 Z , s, 
i, AY1 , s, 
could, K UH1 D , s, 
sift, S IH1 F T , s, 
him, HH IH1 M , s, 
on, AA1 N , s, 
that, DH AE1 T , s, 
argument, ˈ AA : R ɡ ǝ ˌ M e N T, s, 
on, AA1 N , s, 
some, S AH1 M , s, 
apparent, AH0 P EH1 R AH0 N T , s, 
danger, ˈ D EH: : N D ZH ǝ R, s, 
seen, S IY1 N , s, 
in, IH N, s, 
him, HH IH1 M , s, 
aimed, EH: : M IH D, s, 
at, AE1 T , s, 
your, Y AO1 R , s, 
highness, HH AY1 N AH0 S , s, 
no, N OW :, s, 
inveterate, IH N ˈ V e T r ǝ T, s, 
malice, M AE1 L AH0 S , s, 
to, T UW1 , s, 
be, B IY1 , s, 
a, AH0 , s, 
shall, SH AE1 L , s, 
become, B IH ˈ K ɤ M, s, 
my, M AY1 , s, 
age, EY1 JH , s, 
throw, TH r OW :, s, 
down, D ǝ UH N, s, 
my, M AY1 , s, 
son, S AO ̃, s, 
the, DH AH0 , s, 
duke, D UW1 K , s, 
of, AH1 V , s, 
norfolk's, N AO1 R F AH0 K S , s, 
gage, G EH: : D ZH, s, 
when, ʍ e N, s, 
harry, HH EH1 R IY0 , s, 
when, ʍ e N, s, 
obedience, ǝ ˈ B IY : D IH ǝ N S, s, 
bids, B IH1 D Z , s, 
i, AY1 , s, 
should, SH UH1 D , s, 
not, N AA1 T , s, 
bid, B IH1 D , s, 
again, ǝ ˈ ɡ EH: : N, s, 
alas, AH0 L AE1 S , s, 
the, DH AH0 , s, 
part, P AA : R T, s, 
i, AY1 , s, 
had, HH AE1 D , s, 
in, IH N, s, 
blood, B L AH1 D , s, 
doth, D AO1 TH , s, 
more, M AO1 R , s, 
solicit, S AH0 L IH1 S IH0 T , s, 
me, M IY1 , s, 
than, DH AE1 N , s, 
your, Y AO1 R , s, 
exclaims, IH K S ˈ K L EH: : M S, s, 
to, T UW1 , s, 
stir, S T ɐ : R, s, 
against, AH0 G EH1 N S T , s, 
the, DH AH0 , s, 
butchers, B UH1 CH ER0 Z , s, 
of, AH1 V , s, 
his, HH IH1 Z , s, 
life, L AY1 F , s, 
but, B AH1 T , s, 
since, S IH1 N S , s, 
correction, K ER0 EH1 K SH AH0 N , s, 
lieth, ˈ L ǝ IH · ǝ TH, s, 
in, IH N, s, 
those, DH OW1 Z , s, 
hands, AW N D Z, s, 
which, ʍ IH T SH, s, 
made, M EH: : D, s, 
the, DH AH0 , s, 
fault, F AO1 L T , s, 
that, DH AE1 T , s, 
we, W IY1 , s, 
cannot, K AE1 N AA0 T , s, 
correct, K ER0 EH1 K T , s, 
put, P UH1 T , s, 
we, W IY1 , s, 
our, OW : R, s, 
quarrel, ˈ K W AA r ǝ L, s, 
to, T UW1 , s, 
the, DH AH0 , s, 
will, W IH1 L , s, 
of, AH1 V , s, 
heaven, HH EH1 V AH0 N , s, 
who, HH UW1 , s, 
when, ʍ e N, s, 
they, DH EY1 , s, 
see, S IY1 , s, 
the, DH AH0 , s, 
hours, AW1 ER0 Z , s, 
ripe, r ǝ IH P, s, 
on, AA1 N , s, 
earth, ER1 TH , s, 
will, W IH1 L , s, 
rain, r EH: : N, s, 
hot, HH AA1 T , s, 
vengeance, V EH1 N JH AH0 N S , s, 
on, AA1 N , s, 
heads, HH EH1 D Z , s, 
god's, G AA1 D Z , s, 
is, IH1 Z , s, 
the, DH AH0 , s, 
quarrel, ˈ K W AA r ǝ L, s, 
for, F AO1 R , s, 
god's, G AA1 D Z , s, 
substitute, S AH1 B S T AH0 T UW2 T , s, 
his, HH IH1 Z , s, 
deputy, D EH1 P Y AH0 T IY0 , s, 
anointed, ǝ ˈ N ǝ IH N T IH D, s, 
in, IH N, s, 
his, HH IH1 Z , s, 
sight, S AY1 T , s, 
hath, HH AE1 TH , s, 
caused, K AA1 Z D , s, 
his, HH IH1 Z , s, 
death, D EH1 TH , s, 
the, DH AH0 , s, 
which, ʍ IH T SH, s, 
if, IH1 F , s, 
wrongfully, R AO1 NG F AH0 L IY0 , s, 
let, L EH1 T , s, 
heaven, HH EH1 V AH0 N , s, 
revenge, R IY0 V EH1 N JH , s, 
for, F AO1 R , s, 
i, AY1 , s, 
may, M EH: :, s, 
never, ˈ N e V ǝ R, s, 
lift, L IH1 F T , s, 
an, AE1 N , s, 
angry, AE1 NG G R IY0 , s, 
arm, AA1 R M , s, 
against, AH0 G EH1 N S T , s, 
his, HH IH1 Z , s, 
minister, ˈ M IH N IH S T ǝ R, s, 
to, T UW1 , s, 
god, G AA1 D , s, 
the, DH AH0 , s, 
widow's, W IH1 D OW0 Z , s, 
champion, CH AE1 M P IY0 AH0 N , s, 
and, AH0 N D , s, 
defense, D IH0 F EH1 N S , s, 
sister, S IH1 S T ER0 , s, 
farewell, F EH: : R ˈ W e L, s, 
i, AY1 , s, 
must, M AH1 S T , s, 
to, T UW1 , s, 
coventry, K AH1 V AH0 N T R IY0 , s, 
as, AE1 Z , s, 
much, M ɤ T SH, s, 
good, G UH1 D , s, 
stay, S T EH: :, s, 
with, W IH1 DH , s, 
thee, DH IY1 , s, 
as, AE1 Z , s, 
go, G OW :, s, 
with, W IH1 DH , s, 
me, M IY1 , s, 
god, G AA1 D , s, 
in, IH N, s, 
thy, DH AY1 , s, 
good, G UH1 D , s, 
cause, K AA1 Z , s, 
make, M EH: : K, s, 
thee, DH IY1 , s, 
prosperous, P R AA1 S P ER0 AH0 S , s, 
be, B IY1 , s, 
swift, S W IH1 F T , s, 
like, L ǝ IH K, s, 
lightning, ˈ L ǝ IH T N IH N, s, 
in, IH N, s, 
the, DH AH0 , s, 
execution, ˌ e K S IH ˈ K Y UW : S IH ǝ N, s, 
and, AH0 N D , s, 
let, L EH1 T , s, 
thy, DH AY1 , s, 
blows, B L OW : Z, s, 
doubly, ˈ D ɤ B L ǝ IH, s, 
redoubled, R IY0 D AH1 B AH0 L D , s, 
fall, F AA : L, s, 
like, L ǝ IH K, s, 
amazing, AH0 M EY1 Z IH0 NG , s, 
thunder, TH AH1 N D ER0 , s, 
on, AA1 N , s, 
the, DH AH0 , s, 
casque, K AW S K, s, 
of, AH1 V , s, 
thy, DH AY1 , s, 
adverse, ˈ AW D V ǝ R S, s, 
pernicious, P ER0 N IH1 SH AH0 S , s, 
enemy, EH1 N AH0 M IY0 , s, 
rouse, r ǝ UH S, s, 
up, AH1 P , s, 
thy, DH AY1 , s, 
youthful, Y UW1 TH F AH0 L , s, 
blood, B L AH1 D , s, 
be, B IY1 , s, 
valiant, V AE1 L Y AH0 N T , s, 
and, AH0 N D , s, 
live, L AY1 V , s, 
i, AY1 , s, 
thank, TH AE1 NG K , s, 
my, M AY1 , s, 
liege, L IY1 JH , s, 
that, DH AE1 T , s, 
in, IH N, s, 
regard, r IH ˈ G AA : R D, s, 
of, AH1 V , s, 
me, M IY1 , s, 
he, HH IY1 , s, 
shortens, SH AO1 R T AH0 N Z , s, 
four, F AO1 R , s, 
years, Y IH1 R Z , s, 
of, AH1 V , s, 
my, M AY1 , s, 
son's, S AH1 N Z , s, 
exile, ˈ e G Z ǝ IH L, s, 
but, B AH1 T , s, 
little, L IH1 T AH0 L , s, 
vantage, V AE1 N T AH0 JH , s, 
shall, SH AE1 L , s, 
i, AY1 , s, 
reap, R IY1 P , s, 
thereby, DH EH: : R ˈ B ǝ IH, s, 
for, F AO1 R , s, 
ere, EH: : R, s, 
the, DH AH0 , s, 
six, S IH1 K S , s, 
years, Y IH1 R Z , s, 
that, DH AE1 T , s, 
he, HH IY1 , s, 
hath, HH AE1 TH , s, 
to, T UW1 , s, 
spend, S P EH1 N D , s, 
can, K AE1 N , s, 
change, T SH EH: : N D ZH, s, 
their, DH EH1 R , s, 
moons, M UW1 N Z , s, 
and, AH0 N D , s, 
bring, B R IH1 NG , s, 
their, DH EH1 R , s, 
times, T AY1 M Z , s, 
about, ǝ ˈ B ǝ UH T, s, 
my, M AY1 , s, 
lamp, L AE1 M P , s, 
and, AH0 N D , s, 
light, L ǝ IH T, s, 
shall, SH AE1 L , s, 
be, B IY1 , s, 
extinct, IH0 K S T IH1 NG K T , s, 
with, W IH1 DH , s, 
age, EY1 JH , s, 
and, AH0 N D , s, 
endless, EH1 N D L AH0 S , s, 
night, N AY1 T , s, 
my, M AY1 , s, 
inch, IH1 N CH , s, 
of, AH1 V , s, 
taper, ˈ T EH: : P ǝ R, s, 
will, W IH1 L , s, 
be, B IY1 , s, 
burnt, B ER1 N T , s, 
and, AH0 N D , s, 
done, D AH1 N , s, 
and, AH0 N D , s, 
blindfold, ˈ B L ə IH N F OW : L D, s, 
death, D EH1 TH , s, 
not, N AA1 T , s, 
let, L EH1 T , s, 
me, M IY1 , s, 
see, S IY1 , s, 
my, M AY1 , s, 
son, S AO ̃, s, 
but, B AH1 T , s, 
not, N AA1 T , s, 
a, AH0 , s, 
minute, M IH1 N AH0 T , s, 
king, K IH1 NG , s, 
that, DH AE1 T , s, 
thou, DH AW1 , s, 
give, G IH1 V , s, 
shorten, SH AO1 R T AH0 N , s, 
my, M AY1 , s, 
days, D EY1 Z , s, 
thou, DH AW1 , s, 
with, W IH1 DH , s, 
sullen, ˈ S ɤ L ǝ N, s, 
sorrow, ˈ S ɒ r ǝ, s, 
and, AH0 N D , s, 
pluck, P L ɤ K, s, 
nights, N AY1 T S , s, 
from, F R AH1 M , s, 
me, M IY1 , s, 
but, B AH1 T , s, 
not, N AA1 T , s, 
lend, L EH1 N D , s, 
a, AH0 , s, 
morrow, ˈ M ɒ r ǝ, s, 
thou, DH AW1 , s, 
help, e L P, s, 
time, T AY1 M , s, 
to, T UW1 , s, 
furrow, F ER1 OW0 , s, 
me, M IY1 , s, 
with, W IH1 DH , s, 
age, EY1 JH , s, 
but, B AH1 T , s, 
stop, S T AA1 P , s, 
no, N OW :, s, 
wrinkle, R IH1 NG K AH0 L , s, 
in, IH N, s, 
his, HH IH1 Z , s, 
pilgrimage, ˈ P IH L G r IH ˌ M EH: : D ZH, s, 
thy, DH AY1 , s, 
word, W ER1 D , s, 
is, IH1 Z , s, 
current, K ER1 AH0 N T , s, 
with, W IH1 DH , s, 
him, HH IH1 M , s, 
for, F AO1 R , s, 
my, M AY1 , s, 
death, D EH1 TH , s, 
but, B AH1 T , s, 
dead, D EH1 D , s, 
thy, DH AY1 , s, 
kingdom, K IH1 NG D AH0 M , s, 
cannot, K AE1 N AA0 T , s, 
buy, B ə IH, s, 
my, M AY1 , s, 
breath, B R EH1 TH , s, 
things, TH IH1 NG Z , s, 
sweet, S W IY1 T , s, 
to, T UW1 , s, 
taste, T AW S T, s, 
prove, P R UW1 V , s, 
in, IH N, s, 
digestion, D IH ˈ D ZH e S T IH ǝ N, s, 
sour, S OW : R, s, 
you, Y UW1 , s, 
urged, ER1 JH D , s, 
me, M IY1 , s, 
as, AE1 Z , s, 
a, AH0 , s, 
judge, JH AH1 JH , s, 
but, B AH1 T , s, 
i, AY1 , s, 
had, HH AE1 D , s, 
rather, R AE1 DH ER0 , s, 
you, Y UW1 , s, 
would, W UH1 D , s, 
have, HH AE1 V , s, 
bid, B IH1 D , s, 
me, M IY1 , s, 
argue, ˈ AA : R ɡ Y UW :, s, 
like, L ǝ IH K, s, 
a, AH0 , s, 
father, F AA1 DH ER0 , s, 
o, OW :, s, 
had, HH AE1 D , s, 
it, IH1 T , s, 
been, B IH1 N , s, 
a, AH0 , s, 
stranger, ˈ S T r EH: : N D ZH ǝ R, s, 
not, N AA1 T , s, 
my, M AY1 , s, 
child, CH AY1 L D , s, 
to, T UW1 , s, 
smooth, S M UW1 DH , s, 
his, HH IH1 Z , s, 
fault, F AO1 L T , s, 
i, AY1 , s, 
should, SH UH1 D , s, 
have, HH AE1 V , s, 
been, B IH1 N , s, 
more, M AO1 R , s, 
mild, M ǝ IH L D, s, 
a, AH0 , s, 
partial, ˈ P AA : R S IH AA L, s, 
slander, ˈ S L AO : N D ǝ R, s, 
sought, S AO1 T , s, 
i, AY1 , s, 
to, T UW1 , s, 
avoid, ǝ ˈ V ǝ IH D, s, 
and, AH0 N D , s, 
in, IH N, s, 
the, DH AH0 , s, 
sentence, S EH1 N T AH0 N S , s, 
my, M AY1 , s, 
own, OW : N, s, 
life, L AY1 F , s, 
destroyed, D IH ˈ S T r ǝ IH D, s, 
alas, AH0 L AE1 S , s, 
i, AY1 , s, 
looked, L UH K T, s, 
when, ʍ e N, s, 
some, S AH1 M , s, 
of, AH1 V , s, 
you, Y UW1 , s, 
should, SH UH1 D , s, 
say, S EH: :, s, 
i, AY1 , s, 
was, W AA1 Z , s, 
too, T UW1 , s, 
strict, S T R IH1 K T , s, 
to, T UW1 , s, 
make, M EH: : K, s, 
mine, M ǝ IH N, s, 
own, OW : N, s, 
away, ǝ ˈ W EH: :, s, 
but, B AH1 T , s, 
you, Y UW1 , s, 
gave, G EY1 V , s, 
leave, L IY1 V , s, 
to, T UW1 , s, 
my, M AY1 , s, 
unwilling, ɤ N ˈ W IH L IH N, s, 
tongue, T ɒ NG, s, 
against, AH0 G EH1 N S T , s, 
my, M AY1 , s, 
will, W IH1 L , s, 
to, T UW1 , s, 
do, D OW :, s, 
myself, M AY2 S EH1 L F , s, 
this, DH IH1 S , s, 
wrong, R AO1 NG , s, 
o, OW :, s, 
to, T UW1 , s, 
what, W AH1 T , s, 
purpose, ˈ P ɐ : R P ǝ S, s, 
dost, D AA1 S T , s, 
thou, DH AW1 , s, 
hoard, OW : R D, s, 
thy, DH AY1 , s, 
words, W ER1 D Z , s, 
that, DH AE1 T , s, 
thou, DH AW1 , s, 
no, N OW :, s, 
greeting, ˈ G r IY : T IH N, s, 
to, T UW1 , s, 
thy, DH AY1 , s, 
friends, F R EH1 N D Z , s, 
thy, DH AY1 , s, 
grief, G R IY1 F , s, 
is, IH1 Z , s, 
but, B AH1 T , s, 
thy, DH AY1 , s, 
absence, AE1 B S AH0 N S , s, 
for, F AO1 R , s, 
a, AH0 , s, 
time, T AY1 M , s, 
what, W AH1 T , s, 
is, IH1 Z , s, 
six, S IH1 K S , s, 
winters, W IH1 N T ER0 Z , s, 
they, DH EY1 , s, 
are, AA1 R , s, 
quickly, ˈ K W IH K L ǝ IH, s, 
gone, G OW : N, s, 
call, K AO1 L , s, 
it, IH1 T , s, 
a, AH0 , s, 
travel, T R AE1 V AH0 L , s, 
that, DH AE1 T , s, 
thou, DH AW1 , s, 
for, F AO1 R , s, 
pleasure, P L EH1 ZH ER0 , s, 
the, DH AH0 , s, 
sullen, ˈ S ɤ L ǝ N, s, 
passage, P AE1 S AH0 JH , s, 
of, AH1 V , s, 
thy, DH AY1 , s, 
weary, ˈ W IY : r ǝ IH, s, 
steps, S T EH1 P S , s, 
esteem, AH0 S T IY1 M , s, 
as, AE1 Z , s, 
foil, F ǝ IH L, s, 
wherein, ʍ EH: : R ˈ IH N, s, 
thou, DH AW1 , s, 
art, AA : R T, s, 
to, T UW1 , s, 
set, S EH1 T , s, 
the, DH AH0 , s, 
precious, P R EH1 SH AH0 S , s, 
jewel, JH UW1 AH0 L , s, 
of, AH1 V , s, 
thy, DH AY1 , s, 
home, OW : M, s, 
return, r IH ˈ T ɐ : R N, s, 
all, AA : L, s, 
places, ˈ P L EH: : S · IH Z, s, 
that, DH AE1 T , s, 
the, DH AH0 , s, 
eye, ǝ IH, s, 
of, AH1 V , s, 
heaven, HH EH1 V AH0 N , s, 
visits, V IH1 Z AH0 T S , s, 
are, AA1 R , s, 
to, T UW1 , s, 
a, AH0 , s, 
wise, W AY1 Z , s, 
man, M AE1 N , s, 
ports, P AO1 R T S , s, 
and, AH0 N D , s, 
happy, ˈ AW P ǝ IH, s, 
havens, HH EY1 V AH0 N Z , s, 
teach, T IY1 CH , s, 
thy, DH AY1 , s, 
necessity, N AH0 S EH1 S AH0 T IY0 , s, 
to, T UW1 , s, 
reason, ˈ r EH: : Z ǝ N, s, 
thus, DH ɤ S, s, 
there, DH EH1 R , s, 
is, IH1 Z , s, 
no, N OW :, s, 
virtue, V ER1 CH UW0 , s, 
like, L ǝ IH K, s, 
necessity, N AH0 S EH1 S AH0 T IY0 , s, 
think, TH IH1 NG K , s, 
not, N AA1 T , s, 
the, DH AH0 , s, 
king, K IH1 NG , s, 
did, D IH1 D , s, 
banish, B AE1 N IH0 SH , s, 
thee, DH IY1 , s, 
but, B AH1 T , s, 
thou, DH AW1 , s, 
the, DH AH0 , s, 
king, K IH1 NG , s, 
woe, W OW1 , s, 
doth, D AO1 TH , s, 
the, DH AH0 , s, 
heavier, ˈ e V ǝ IH ǝ R, s, 
sit, S IH1 T , s, 
where, ʍ EH: : R, s, 
it, IH1 T , s, 
perceives, P ER0 S IY1 V Z , s, 
it, IH1 T , s, 
is, IH1 Z , s, 
but, B AH1 T , s, 
faintly, F EY1 N T L IY0 , s, 
borne, B AO : R N, s, 
go, G OW :, s, 
say, S EH: :, s, 
i, AY1 , s, 
sent, S EH1 N T , s, 
thee, DH IY1 , s, 
forth, ˈ F AO : R TH, s, 
to, T UW1 , s, 
purchase, ˈ P ɐ : R T SH IH S, s, 
honor, AA1 N ER0 , s, 
and, AH0 N D , s, 
not, N AA1 T , s, 
the, DH AH0 , s, 
king, K IH1 NG , s, 
exiled, ˈ e G Z ǝ IH L D, s, 
thee, DH IY1 , s, 
or, AO : R, s, 
suppose, S ǝ ˈ P OW : Z, s, 
devouring, D IH0 V AW1 ER0 IH0 NG , s, 
pestilence, P EH1 S T AH0 L AH0 N S , s, 
hangs, AW NG Z, s, 
in, IH N, s, 
our, OW : R, s, 
air, EH: R, s, 
and, AH0 N D , s, 
thou, DH AW1 , s, 
art, AA : R T, s, 
flying, ˈ F L ǝ IH IH N, s, 
to, T UW1 , s, 
a, AH0 , s, 
fresher, F R EH1 SH ER0 , s, 
clime, K L ǝ IH M, s, 
look, L UH1 K , s, 
what, W AH1 T , s, 
thy, DH AY1 , s, 
soul, S OW1 L , s, 
holds, OW : L D Z, s, 
dear, D IY : R, s, 
imagine, IH ˈ M AW D ZH IH N, s, 
it, IH1 T , s, 
to, T UW1 , s, 
lie, L ǝ IH, s, 
that, DH AE1 T , s, 
way, W EY1 , s, 
thou, DH AW1 , s, 
goest, G OW : S T, s, 
not, N AA1 T , s, 
whence, ʍ e N S, s, 
thou, DH AW1 , s, 
suppose, S ǝ ˈ P OW : Z, s, 
the, DH AH0 , s, 
singing, ˈ S IH NG G IH N, s, 
birds, B ɐ : R D Z, s, 
musicians, M Y UW0 Z IH1 SH AH0 N Z , s, 
the, DH AH0 , s, 
grass, G R AE1 S , s, 
thou, DH AW1 , s, 
the, DH AH0 , s, 
presence, P R EH1 Z AH0 N S , s, 
the, DH AH0 , s, 
flowers, F L AW1 ER0 Z , s, 
fair, F EH: : R, s, 
ladies, L EY1 D IY0 Z , s, 
and, AH0 N D , s, 
thy, DH AY1 , s, 
steps, S T EH1 P S , s, 
no, N OW :, s, 
more, M AO1 R , s, 
than, DH AE1 N , s, 
a, AH0 , s, 
delightful, D IH ˈ L ǝ IH T F UH L, s, 
measure, ˈ M e Z ǝ R, s, 
or, AO : R, s, 
a, AH0 , s, 
dance, D AW N S, s, 
for, F AO1 R , s, 
gnarling, N AA1 R L IH0 NG , s, 
sorrow, ˈ S ɒ r ǝ, s, 
hath, HH AE1 TH , s, 
less, L EH1 S , s, 
power, P OW : R, s, 
to, T UW1 , s, 
bite, B AY1 T , s, 
the, DH AH0 , s, 
man, M AE1 N , s, 
that, DH AE1 T , s, 
mocks, M AA1 K S , s, 
at, AE1 T , s, 
it, IH1 T , s, 
and, AH0 N D , s, 
sets, S EH1 T S , s, 
it, IH1 T , s, 
light, L ǝ IH T, s, 
come, K ɤ M, s, 
come, K ɤ M, s, 
my, M AY1 , s, 
son, S AO ̃, s, 
i'll, AY1 L , s, 
bring, B R IH1 NG , s, 
thee, DH IY1 , s, 
on, AA1 N , s, 
thy, DH AY1 , s, 
way, W EY1 , s, 
had, HH AE1 D , s, 
i, AY1 , s, 
thy, DH AY1 , s, 
youth, Y UW1 TH , s, 
and, AH0 N D , s, 
cause, K AA1 Z , s, 
i, AY1 , s, 
would, W UH1 D , s, 
not, N AA1 T , s, 
stay, S T EH: :, s, 
will, W IH1 L , s, 
the, DH AH0 , s, 
king, K IH1 NG , s, 
come, K ɤ M, s, 
that, DH AE1 T , s, 
i, AY1 , s, 
may, M EH: :, s, 
breathe, B R IY1 DH , s, 
my, M AY1 , s, 
last, L AE1 S T , s, 
in, IH N, s, 
wholesome, ˈ OW : L S ǝ M, s, 
counsel, ˈ K ǝ UH N S ǝ L, s, 
to, T UW1 , s, 
his, HH IH1 Z , s, 
youth, Y UW1 TH , s, 
o, OW :, s, 
but, B AH1 T , s, 
they, DH EY1 , s, 
say, S EH: :, s, 
the, DH AH0 , s, 
tongues, T AH1 NG Z , s, 
of, AH1 V , s, 
dying, D AY1 IH0 NG , s, 
men, M EH1 N , s, 
enforce, EH0 N F AO1 R S , s, 
attention, AH0 T EH1 N SH AH0 N , s, 
like, L ǝ IH K, s, 
deep, D IY1 P , s, 
harmony, HH AA1 R M AH0 N IY0 , s, 
where, ʍ EH: : R, s, 
words, W ER1 D Z , s, 
are, AA1 R , s, 
scarce, S K EH1 R S , s, 
they, DH EY1 , s, 
are, AA1 R , s, 
seldom, S EH1 L D AH0 M , s, 
spent, S P EH1 N T , s, 
in, IH N, s, 
vain, V EY1 N , s, 
for, F AO1 R , s, 
they, DH EY1 , s, 
breathe, B R IY1 DH , s, 
truth, T R UW1 TH , s, 
that, DH AE1 T , s, 
breathe, B R IY1 DH , s, 
their, DH EH1 R , s, 
words, W ER1 D Z , s, 
in, IH N, s, 
pain, P EH: : N, s, 
he, HH IY1 , s, 
that, DH AE1 T , s, 
no, N OW :, s, 
more, M AO1 R , s, 
must, M AH1 S T , s, 
say, S EH: :, s, 
is, IH1 Z , s, 
listened, L IH1 S AH0 N D , s, 
more, M AO1 R , s, 
than, DH AE1 N , s, 
they, DH EY1 , s, 
whom, HH UW1 M , s, 
youth, Y UW1 TH , s, 
and, AH0 N D , s, 
ease, IY1 Z , s, 
have, HH AE1 V , s, 
taught, T AO1 T , s, 
to, T UW1 , s, 
gloze, G L OW : Z, s, 
more, M AO1 R , s, 
are, AA1 R , s, 
men's, M EH1 N Z , s, 
ends, EH1 N D Z , s, 
marked, M AA1 R K T , s, 
than, DH AE1 N , s, 
their, DH EH1 R , s, 
lives, L IH1 V Z , s, 
before, B IH0 F AO1 R , s, 
the, DH AH0 , s, 
setting, S EH1 T IH0 NG , s, 
sun, S AH1 N , s, 
and, AH0 N D , s, 
music, M Y UW1 Z IH0 K , s, 
at, AE1 T , s, 
the, DH AH0 , s, 
close, K L OW : Z, s, 
as, AE1 Z , s, 
the, DH AH0 , s, 
last, L AE1 S T , s, 
taste, T AW S T, s, 
of, AH1 V , s, 
sweets, S W IY1 T S , s, 
is, IH1 Z , s, 
sweetest, S W IY1 T AH0 S T , s, 
last, L AE1 S T , s, 
writ, R IH1 T , s, 
in, IH N, s, 
remembrance, r IH ˈ M e M B r ǝ N S, s, 
more, M AO1 R , s, 
than, DH AE1 N , s, 
things, TH IH1 NG Z , s, 
long, L AO1 NG , s, 
past, P AW S T, s, 
though, DH OW1 , s, 
richard, ˈ r IH T SH ǝ R D, s, 
my, M AY1 , s, 
life's, L AY1 F S , s, 
counsel, ˈ K ǝ UH N S ǝ L, s, 
would, W UH1 D , s, 
not, N AA1 T , s, 
hear, IY : R, s, 
my, M AY1 , s, 
death's, D EH1 TH S , s, 
sad, S AE1 D , s, 
tale, T EH: : L, s, 
may, M EH: :, s, 
yet, Y EH1 T , s, 
his, HH IH1 Z , s, 
ear, IY : R, s, 
methinks, M IH ˈ TH IH NG K S, s, 
i, AY1 , s, 
am, AE1 M , s, 
a, AH0 , s, 
prophet, P R AA1 F AH0 T , s, 
new, N UW1 , s, 
inspired, IH N ˈ S P ǝ IH R IH D, s, 
and, AH0 N D , s, 
thus, DH ɤ S, s, 
expiring, IH0 K S P AY1 R IH0 NG , s, 
do, D OW :, s, 
foretell, F AO0 R T EH1 L , s, 
of, AH1 V , s, 
him, HH IH1 M , s, 
his, HH IH1 Z , s, 
rash, R AE1 SH , s, 
fierce, F IH1 R S , s, 
blaze, B L EH: : Z, s, 
of, AH1 V , s, 
riot, R AY1 AH0 T , s, 
cannot, K AE1 N AA0 T , s, 
last, L AE1 S T , s, 
for, F AO1 R , s, 
violent, ˈ V ǝ IH ǝ ˌ L e N T, s, 
fires, F AY1 ER0 Z , s, 
soon, S UW1 N , s, 
burn, B ER1 N , s, 
out, AW1 T , s, 
themselves, DH EH0 M S EH1 L V Z , s, 
small, S M AO1 L , s, 
showers, SH OW : R Z, s, 
last, L AE1 S T , s, 
long, L AO1 NG , s, 
but, B AH1 T , s, 
sudden, S AH1 D AH0 N , s, 
storms, S T AO : R M Z, s, 
are, AA1 R , s, 
short, SH AO : R T, s, 
he, HH IY1 , s, 
tires, T ǝ IH R Z, s, 
betimes, B IH ˈ T ə IH M Z, s, 
that, DH AE1 T , s, 
spurs, S P ɐ : R Z, s, 
too, T UW1 , s, 
fast, F AW S T, s, 
betimes, B IH ˈ T ə IH M Z, s, 
with, W IH1 DH , s, 
eager, ˈ IY : G ǝ R, s, 
feeding, ˈ F IY : D IH N, s, 
food, F UW1 D , s, 
doth, D AO1 TH , s, 
choke, T SH OW : K, s, 
the, DH AH0 , s, 
feeder, ˈ F IY : D ǝ R, s, 
light, L ǝ IH T, s, 
vanity, V AE1 N AH0 T IY0 , s, 
cormorant, ˈ K AO : R M ǝ ˌ r AW N T, s, 
consuming, K AH0 N S UW1 M IH0 NG , s, 
means, M IY1 N Z , s, 
soon, S UW1 N , s, 
preys, P r EH: : Z, s, 
upon, AH0 P AA1 N , s, 
itself, IH0 T S EH1 L F , s, 
this, DH IH1 S , s, 
royal, ˈ r ǝ IH ǝ AA L, s, 
throne, TH r OW : N, s, 
of, AH1 V , s, 
kings, K IH1 NG Z , s, 
this, DH IH1 S , s, 
isle, ǝ IH L, s, 
this, DH IH1 S , s, 
earth, ER1 TH , s, 
of, AH1 V , s, 
majesty, M AE1 JH AH0 S T IY0 , s, 
this, DH IH1 S , s, 
seat, S IY1 T , s, 
of, AH1 V , s, 
mars, M AA : R Z, s, 
this, DH IH1 S , s, 
other, AH1 DH ER0 , s, 
eden, IY1 D AH0 N , s, 
this, DH IH1 S , s, 
fortress, ˈ F AO : R T r ǝ S, s, 
built, B IH1 L T , s, 
by, B AY1 , s, 
nature, N EY1 CH ER0 , s, 
for, F AO1 R , s, 
herself, HH ER0 S EH1 L F , s, 
against, AH0 G EH1 N S T , s, 
infection, IH N ˈ F e K S IH ǝ N, s, 
and, AH0 N D , s, 
the, DH AH0 , s, 
hand, AW N D, s, 
of, AH1 V , s, 
war, W AO1 R , s, 
this, DH IH1 S , s, 
happy, ˈ AW P ǝ IH, s, 
breed, B R IY1 D , s, 
of, AH1 V , s, 
men, M EH1 N , s, 
this, DH IH1 S , s, 
little, L IH1 T AH0 L , s, 
world, W ER1 L D , s, 
this, DH IH1 S , s, 
precious, P R EH1 SH AH0 S , s, 
stone, S T OW : N, s, 
set, S EH1 T , s, 
in, IH N, s, 
the, DH AH0 , s, 
silver, S IH1 L V ER0 , s, 
sea, S IY1 , s, 
which, ʍ IH T SH, s, 
serves, S ER1 V Z , s, 
it, IH1 T , s, 
in, IH N, s, 
the, DH AH0 , s, 
office, AO1 F AH0 S , s, 
of, AH1 V , s, 
a, AH0 , s, 
wall, W AO1 L , s, 
or, AO : R, s, 
